タイトル,あらすじ,ジャンル
怪物くん,ワガママで世間知らずな怪物ランド（怪物界）の王子、怪物太郎（怪物くん）。将来を心配した父の怪物大王は、修業させようと、ドラキュラ、オオカミ男、フランケンをお供につけ、人間界へと送り出した。そこで住居とした怪物屋敷の隣に住む少年ヒロシと仲良くなった怪物くんは、人間界で暮らす怪物たちの面倒を見たり、全世界の征服を企む悪魔たちの秘密組織、デモーニッシュと戦いながら、修業を積む。,アニメ
神撃のバハムート VIRGIN SOUL,ここは、《人》《神》《魔》あらゆる種族が入り混じる神秘の世界ミスタルシア バハムート復活による世界崩壊を免れてから10年─── 新たな《人》の王は《神》の神殿を襲い《魔》の国を攻め落とした 壊滅寸前だった状況からの復興と更なる発展 王都は《人》に富をもたらす 王都復興の糧として奴隷となる《魔》 消えゆく信仰心により力を失った《神》 均衡を失っていく世界で《人》《神》《魔》それぞれの正義が交錯する---（C）Cygames/MAPPA/神撃のバハムート VIRGIN SOUL,アニメ
幽☆遊☆白書,皿屋敷中学最強の不良と恐れられている浦飯幽助は、ある日、子供を助けようとして交通事故に遭い、あっけなく死んでしまう。だがその死は、霊界にとっても予想外の出来事だった。天国はもちろん、地獄にさえも幽助の行く場所はない。困り果てたエンマ大王のJr.・コエンマは幽助に試練を与え、その心を試した上で生き返らせるという話を持ち掛ける。その試練とは、人間界で起こる異界の生物のが絡んでいる事件を解決する、霊界探偵としての使命を全うする事だった。　　原作／冨樫義博「幽☆遊☆白書」（集英社「ジャンプコミックス」刊）　(C)Yoshihiro Togashi 1990年-1994年　(C)ぴえろ／集英社,アニメ
真夜中のオカルト公務員,フツーの公務員になったはずの新宿区役所職員・宮古新が配属されたのは、東京23区すべての区役所に人知れず存在する「夜間地域交流課」だった。そのお仕事は、人ならざる者が関与するオカルト的事象の解決。先輩で課のリーダー榊京一、オカルトマニア姫塚セオに連れられて人の世の理を超越した存在と対峙しに、夜な夜な出勤する。 ©2019 たもつ葉子／KADOKAWA／「真夜中のオカルト公務員」製作委員会,アニメ
世話やきキツネの仙狐さん,日々、自宅とブラック会社を往復する会社員・中野のもとに押しかけてきた神使のキツネ・仙狐さん（800歳・幼女）。彼女は疲労困憊の中野を、食事、洗濯、特別サービス(？)でめいっぱい“お世話”して、潤してくれるのです。突然始まる、仙狐さんと中野の共同生活。現代社会に疲れた全ての人に届けたい、お世話系甘やかしコメディ！©2019 リムコロ／KADOKAWA／世話やきキツネの仙狐さん製作委員会,アニメ
グランベルム,世界中の魔力が消失してから1000年近くの時間が過ぎ、すでに魔法は人々の記憶からもすっかり忘れられていた。そんな世界で生きる明るく元気な高校生、小日向満月は前向きに暮らしながらも、心のどこかに不安を抱えていた。自分には何もない--。勉強も運動も得意ではない彼女は、自分だけにできる“何か”に憧れていた。夜空の月がやけに大きく感じられた満月の晩。彼女はもうひとりの月の名を持つ少女、新月エルネスタ深海と出会う。それは魔法人形“アルマノクス”との遭遇でもあった。満月の運命の歯車が、軋んだ音を立てて今動き始める--。 ©ProjectGRANBELM,アニメ
戦姫絶唱シンフォギアAXZ,ワールドデストラクターである「チフォージュ・シャトー」を駆使した、錬金術師キャロルによる世界解剖計画の阻止から数週間後。シンフォギア装者たちを苦しめ、一度ならず敗退へと追い詰めた「アルカ・ノイズ」の脅威は世界各地に蔓延していた。時おかずして発生する次なる事件に、何かしらの関連性を疑いつつ鎮圧にあたる装者たち。熱帯夜に遭遇したのは、通常物理法則の埒外にある怪物「ヨナルデパズトーリ」と、怪物を「神の力」と呼び、自在に使役する三人の錬金術師であった。錬金術師たちが属する秘密組織は、これまでにシンフォギア装者たちが乗り越えてきた騒乱に関わってきたばかりか、人類史の裏側に暗躍してきた恐るべき敵対勢力である。ついに顕現、そして強襲するかつてない脅威に戦慄を隠せないシンフォギア装者たち。人知れず奪われた聖遺物「アンティキティラの歯車」は、無邪気な瞳のホロスコープに巨大な陰謀を映し出すのであった。,アニメ
僕らはみんな河合荘,下宿｢河合荘｣で念願の一人暮らしをすることになった高校1年男子･宇佐｡ そこにはあこがれの先輩･律も住んでいて､宇佐は楽しい高校生活を夢見るが･･･?[ドラマ/青春](C)宮原るり･少年画報社/委員会はみんな河合荘,アニメ
恋は雨上がりのように,陸上部のエースだったが怪我で走ることをやめてしまった橘あきら（17歳）と、夢を諦めた過去を持つあきらのバイト先、ファミレス「ガーデン」の店長・近藤正己（45歳）。海辺の街を舞台に、青春の交差点で立ち止まったままの彼女と、人生の折り返し地点にさしかかった彼が織りなすものがたり。 胸が熱くなる瞬間を、本当は誰だって待ってる--。(C)眉月じゅん・小学館／アニメ「恋雨」製作委員会,アニメ
BEATLESS,社会のほとんどをhIEと呼ばれる人型ロボットに任せた世界。 17歳の少年・遠藤アラトはある日一体のアンドロイド・レイシアに出会い、オーナー契約を交わす。 一見人間とそっくりなそれは、世界を驚かすほどの性能を備えた超高性能AIが生み出した、人智を越えるアンドロイド＜人類未到産物＞５体のひとつだった--。 ５つの機体はそれぞれ意味を持ち、互いの性能を求め戦いはじめる。 その戦いを傍観することしかできない大人たちと、その存在に近づき新しい関係を試みる少年たち。 未来への選択と、人間とモノとの関係の答えを求められる--。 進化しすぎた機械と、人間世界を繋ぐのは何か？ 便利になりすぎた時代で何が大事で何が必要なのか、 アラトは人間よりはるかに優れたアンドロイド・レイシアと出会ったことで 未来への選択と、人間とモノとの関係の答えを求められる--。,アニメ
甘々と稲妻,ひとり娘と二人で暮らす高校教師が、ふとしたきっかけから教え子の女子高生と三人でごはんを作って食べることに。三人とも料理はまったくできないけれど、美味しいごはんはとっても大好き！あったかくって楽しいひとときが、きっとあなたを夢中にさせる！(c)雨隠ギド・講談社／「甘々と稲妻」製作委員会,アニメ
ご注文はうさぎですか？,"Koiによる4コマ漫画を原作に、WHITE FOXがアニメーション制作を手がけた作品(C)Koi・芳文社,ご注文は製作委員会ですか？",アニメ
昭和元禄落語心中,刑務所の落語慰問会で見た大名人・八雲の「死神」が忘れられず、出所した与太郎が真っ先に向かった先は、寄席だった。拝み倒して八雲の住み込みの弟子となった与太郎だが、八雲の元では小夏という女性が暮らしていた。八雲と小夏には他人が容易に触れられない因縁があるらしく・・・。,アニメ
怪盗ジョーカー,「輝く夜へようこそ！」 怪盗ジョーカー！ただ盗むだけじゃない！大胆不敵！神出鬼没！華麗に奇跡を起こす《ミラクルメイカー》！相棒のハチとともにお宝をもとめて全世界へ！さあ、ショーが開幕だ！ 見たことがあるものならどんな人や物にでも変身できる便利な怪盗道具《イメージガム》！秘密基地でもある飛行船《スカイジョーカー》や愛車《ロードジョーカー》を使い世界をかけめぐる！ちょっとドジだがジョーカーをしっかりサポートしている料理の腕はプロ顔負けの相棒、忍者のハチ！ジョーカーと同じ師匠のもとで修行した最大のライバル、怪盗スペード！ともに修行した女怪盗ダイヤモンド・クイーン！そんな彼らと世界中を飛びまわり、立ちはだかる警部や探偵たちの罠をくぐり抜け、どんなピンチも奇跡のトリックをおこし、次々と名画やお宝を盗み出す!! (C)たかはしひでやす・小学館／怪盗ジョーカープロジェクト,アニメ
電脳コイル,時は202X年、今よりもちょっと未来。子供達の間で“電脳メガネ”が大流行していた。この“電脳メガネ”は、街のどこからでもネットに接続し様々な情報を表示する機能を備えた、子供たちになくてはならないアイテムだ。現代の携帯電話のように普及し、ほぼ全ての子供が持っている。舞台は由緒ある神社仏閣が建ち並ぶ古都でありながら、最新の電脳インフラを擁する地方都市「大黒市」。小此木優子（おこのぎゆうこ） は、小学校最後の夏休みを目前に、父の仕事の都合で大黒市に引っ越すことになる。そこで出会ったのは、もう一人の“ユウコ”、天沢勇子（あまさわゆうこ） 。同じ名前で同じ歳だが全くタイプの違う二人。新しい学校で個性豊かな子供たちと出会い、電脳空間で次々と巻き起こるフシギな出来事を体験する。(c)磯 光雄／徳間書店・電脳コイル製作委員会,アニメ
怪盗ジョーカー,「輝く夜へようこそ！」 怪盗ジョーカー！ただ盗むだけじゃない！大胆不敵！神出鬼没！華麗に奇跡を起こす《ミラクルメイカー》！相棒のハチとともにお宝をもとめて全世界へ！さあ、ショーが開幕だ！ 見たことがあるものならどんな人や物にでも変身できる便利な怪盗道具《イメージガム》！秘密基地でもある飛行船《スカイジョーカー》や愛車《ロードジョーカー》を使い世界をかけめぐる！ちょっとドジだがジョーカーをしっかりサポートしている料理の腕はプロ顔負けの相棒、忍者のハチ！ジョーカーと同じ師匠のもとで修行した最大のライバル、怪盗スペード！ともに修行した女怪盗ダイヤモンド・クイーン！そんな彼らと世界中を飛びまわり、立ちはだかる警部や探偵たちの罠をくぐり抜け、どんなピンチも奇跡のトリックをおこし、次々と名画やお宝を盗み出す!! (C)たかはしひでやす・小学館／怪盗ジョーカープロジェクト,アニメ
どろろんぱっ,死んで百年経っても成仏しない浮遊霊の小野小町（おのこまち）は自称、美少女幽霊。小学生の大福寺あんこが両親と引っ越してきた新築の家に住み着いていた。あんこは、祖父でお寺の住職の藻奈寛からもらった数珠で小町を払おうとするが、長い幽霊暮らしの経験で身をかわし、そのまま大福寺家に居座る。そこに、小町を成仏させようと見習い天使が来たり、悪魔が顔を出したりのおマヌケゴーストストーリー。,アニメ
甲鉄城のカバネリ 海門決戦,世界中に産業革命の波が押し寄せ、近世から近代に移り変わろうとした頃、突如として不死の怪物が現れた。後にカバネと呼ばれる事になるそれらは、甲鉄の皮膜に覆われた心臓を持ち、噛んだ者までもカバネにしてしまう。カバネは爆発的に増殖し、全世界を覆いつくしていった。極東の島国である日ノ本で、分厚い装甲に覆われた蒸気機関車、通称・駿城の一つ、甲鉄城に乗り込んだ生駒たちは、熾烈な戦いを潜り抜け、カバネと人の新たな攻防戦の地、日本海に面する廃坑駅「海門」に辿りついた。生駒たちは、同じくカバネから「海門」を奪取せんとする、玄路、虎落、海門の民と「連合軍」を結成し、カバネ撃退の策を立てるのだが、「海門」の地にはある〝秘密〟が隠されているのだった-。©カバネリ製作委員会,アニメ
亜人ちゃんは語りたい,サキュバス、デュラハン、雪女、そしてバンパイア--。僕ら人間とちょっとだけ違う、それが「亜人（あじん）」。最近じゃデミと呼ばれてます。そんな個性的な「亜人（デミ）」ちゃんたちと、彼女たちに興味津々な高校生物教師・高橋鉄男が繰り広げる、ちょっと刺激的でハートフルな学園亜人コメディ！,アニメ
冴えない彼女の育てかた♭,オタク高校生「安芸倫也」が、ある日桜舞い散る坂道で運命的な出会いをしたのは、クラスメイトで目立たない普通の少女「加藤恵」だった。恵をメインヒロインにしたギャルゲーを制作しようと考えた倫也は、原画担当に金髪の幼馴染「澤村・スペンサー・絵梨々」を、シナリオ担当に学年一の先輩優等生「霞ヶ丘詩羽」を加え、同人サークル“blessing software”を立ち上げる。そこに音楽担当となる従姉妹「氷堂美智留」を加え、ようやく彼らのギャルゲーは一つのルート完成までこぎつける。２カ月後に冬コミを控えた倫也たち。果たして無事にゲームを完成させることができるのか!?本格的青春グラフィティ再び、ここに開幕-。（C）2017丸戸史明・深崎暮人・KADOKAWAファンタジア文庫刊／冴えない♭な製作委員会,アニメ
少女終末旅行,繁栄と栄華を極めた人間たちの文明が崩壊してから長い年月が過ぎた。生き物のほとんどが死に絶え、全てが終わってしまった世界。残されたのは廃墟となった巨大都市と朽ち果てた機械だけ。いつ世界は終わってしまったのか、なぜ世界は終わってしまったのか、そんなことを疑問にさえ思わなくなった終わりの世界で、ふたりぼっちになってしまった少女、チトとユーリ。ふたりは今日も延々と続く廃墟の中を、愛車ケッテンクラートに乗って、あてもなく彷徨う。全てが終わりを迎えた世界を舞台に、ふたりの少女が旅をする終末ファンタジーが今、幕を開ける。（C）つくみず・新潮社／「少女終末旅行」製作委員会,アニメ
TVアニメ「ペルソナ５」 『Dark Sun.／Stars and Ours』,高校2年生の春、雨宮 蓮は東京の「秀尽学園」に転入する。ある出来事をきっかけに“ペルソナ”使いとして覚醒した蓮は、新たに出会った仲間達とともに「心の怪盗団」を結成。悪しき欲望に塗れた大人達の“歪んだ欲望”を盗んで改心させていく。一方、街では不可解な精神暴走事件が次々と起こっていた……。大都会“東京”を舞台に高校生として日常生活を送りながらも、放課後は「心の怪盗団」として暗躍する―。壮大なピカレスクロマンの幕が切って落とされる！衝撃のシーンで最終回のラストを飾ったTVアニメ「ペルソナ５」。特番アニメーションでは、第26話のその後を描く。漆黒の太陽が昇りゆく世界で絆を――輝きを取り戻せるのか…？そして心の怪盗団は最後の戦いに赴く…！(C)ATLUS (C)SEGA/PERSONA5 the Animation Project,アニメ
がっこうぐらし！,シャベルを愛する（？）くるみ、皆をまとめるりーさん、しっかり者の後輩みーくん、おっとりした顧問のめぐねえらに囲まれた丈槍ゆきの瞳に映る幸せな“日常”はしかし…!?　(C)Nitroplus／海法紀光・千葉サドル・芳文社／がっこうぐらし！製作委員会,アニメ
殺戮の天使,"ビルの地下の最下層で目を覚ました少女、レイチェル。 彼女は記憶を失い、自分がどうしてここにいるかさえ分からずにいた。 地上を目指し、ビルの中をさまよう彼女の前に現れたのは、顔を包帯で覆い、死神のような鎌を持った殺人鬼ザック。 「お願いがあるの…お願い、私を殺して」 「一緒にここから出る手助けをしてくれよ。そしたらお前を、殺してやるよ」 二人の奇妙な絆は、その"" 誓い""をキッカケに深まっていく。 果たして、ここはどこなのか。二人は何の目的で閉じこめられたのか。彼らを待ち受ける運命とは。 密閉されたビルから脱出する二人の決死行がはじまった……！",アニメ
クズの本懐,"※本編には一部の視聴者様には不快に感じるおそれのある刺激的な描写を含む可能性があります。 報われない恋　切ない恋　片想い それってそんなに美しい物ですか 高校二年生の安楽岡花火は、叶わぬ恋に身を焦がしていた。 大事な人を傷つけ、傷つきながらも求めてしまう人のぬくもり。 これは、あまりにも純粋で歪んだ恋愛ストーリー。（C）MY/SQEX,S",アニメ
黒魔女さんが通る!!,オカルト好きの小学5年生、黒鳥千代子（通称チョコ）はクラスメイトに頼まれた恋占いで恋のキューピットを呼び出そうとしたら、その日はちょうど鼻づまりで・・・。魔界から黒魔女ギュービッドを呼び出してしまった！その日から、「魔界一熱い指導」を自負するインストラクター黒魔女・ギュービッドによる黒魔女修行が始まった。朝５時おき！部屋の掃除！学校の宿題よりもぶあつい黒魔女ドリル！！！！サボろうものならギュービッドさまに「この低級黒魔女が！」と、お仕置きされる始末。黒魔女修行はつらいよ……トホホホ。ひょんなことから黒魔女修行をするはめになったチョコ。時にはギュービッドと喧嘩しながらも、学校と魔界を舞台に１人前の黒魔女を目指して、チョコの黒魔女修行は続く！,アニメ
北斗の拳２,"ラオウとの死闘から5年、ケンシロウの手によって取り戻されたはずの平和は乱れ、天帝を操る総督ジャコウによって、再び世は混沌に投げ出された。そんな天帝軍に北斗の反旗を翻すのは、成長したリンとバット。二人の前に、ケンシロウが姿を現す！賞金稼ぎのアインや元斗皇拳の継承者ファルコとの対決の中で、天帝ルイとリンの出生の秘密が明かされる。修羅の国での、北斗琉拳の使い手シャチ、羅将ハン、ケンシロウの実兄ヒョウとの死闘。そして北斗宗家2000年の深い愛と哀しみを心に刻み付け、悪に身を染めたラオウの実兄・魔人カイオウとの最終決戦！勝利の女神はどちらに微笑むのか!?(C)武論尊・原哲夫/NSP・東映アニメーション 1987,版権許諾証TH-116",アニメ
りゅうおうのおしごと！,玄関を開けるとJSがいた--「やくそくどおり、弟子にしてもらいにきました！」16歳にして将棋界の最強タイトル保持者『竜王』となった九頭竜八一の自宅に押しかけてきたのは、小学三年生の雛鶴あい。9歳。「え？　…弟子？　え？」「…おぼえてません？」覚えていなかったが始まってしまったJSとの同居生活。ストレートなあいの情熱に、八一も失いかけていた熱いモノを取り戻していくのだった。(C)白鳥士郎・SBクリエイティブ/りゅうおうのおしごと！製作委員会,アニメ
Angel Beats!,舞台は死後の世界運命に立ち向かう少年少女たちの物語なんらかの理由で最後を遂げた少年・音無は、死後の世界の学校で、ゆりと名乗る少女と出会う。彼女は神に反逆する「死んだ世界戦線」のリーダーで、天使と日夜激戦を繰り広げていた。そして、立ちはだかるは神の使い・天使。それは、可憐なひとりの少女だった。生前の記憶が無く、この死後の世界で何が起きているのかも分からず戸惑う音無。彼は、ゆりたちと共に戦う道を選ぶことにしたのだが…。(C)VisualArt's/Key/Angel Beats! Project,アニメ
怪盗ジョーカー,「輝く夜へようこそ！」 怪盗ジョーカー！ただ盗むだけじゃない！大胆不敵！神出鬼没！華麗に奇跡を起こす《ミラクルメイカー》！相棒のハチとともにお宝をもとめて全世界へ！さあ、ショーが開幕だ！ 見たことがあるものならどんな人や物にでも変身できる便利な怪盗道具《イメージガム》！秘密基地でもある飛行船《スカイジョーカー》や愛車《ロードジョーカー》を使い世界をかけめぐる！ちょっとドジだがジョーカーをしっかりサポートしている料理の腕はプロ顔負けの相棒、忍者のハチ！ジョーカーと同じ師匠のもとで修行した最大のライバル、怪盗スペード！ともに修行した女怪盗ダイヤモンド・クイーン！そんな彼らと世界中を飛びまわり、立ちはだかる警部や探偵たちの罠をくぐり抜け、どんなピンチも奇跡のトリックをおこし、次々と名画やお宝を盗み出す!! (C)たかはしひでやす・小学館／怪盗ジョーカープロジェクト,アニメ
パーマン,平凡な小学生、須羽ミツ夫は、バード星からやってきたバードマンにある日「パーマン」に任命されて、正義の味方として活動することになったんだ。迷子の世話からギャング退治まで、毎日大忙し。マスクで素顔を隠し、6600倍のパワーと時速119kmの飛行能力が出せる「パーマンセット」を身につけて、大活躍！　南の島にも砂漠にも、北極にだってひとっ飛びだ。パーマンの正体は絶対秘密。家族にも友達にも打ち明けられないのが、ツラいんだよなぁ。パーマンと小学生の「二足のわらじ」、けっこう疲れるんだよ。トホホ。でも大丈夫、パーマンには仲間がいます。おサルのブービーにおてんばパー子、なにわのパーやんと、4人そろえばこわいものなし！ 時にはズッコケ、時には悩みながら、友情と正義の心で困難に立ち向かう等身大のヒーローを描いた、藤子・F・不二雄原作の国民的名作アニメ。(C)藤子プロ／シンエイ・小学館,アニメ
モンスター娘のいる日常,「他種族間交流法」の施行により、人間以外の種族との交流が認められた日本。ある手違いにより、主人公・来留主公人のもとに他種族の女の子（モンスター娘）たちが続々と転がり込んできて、共同生活を送ることに…！？モテモテハーレム状態だけど、他種族とのふか～い交流は、法律で厳しく禁止されていて…？可愛いけれど、ちょっとちがうモンスター娘たちと過ごす、少し変わった毎日がはじまる…(C)2015 オカヤド／徳間書店・モン娘パートナーズ,アニメ
けものフレンズ,この世界のどこかにつくられた超巨大総合動物園「ジャパリパーク」。 そこでは神秘の物質「サンドスター」の力で、動物たちが次々とヒトの姿をした「アニマルガール」へと変身--！ 訪れた人々と賑やかに楽しむようになりました。 しかし、時は流れ……。 ある日、パークに困った様子の迷子の姿が。 帰路を目指すための旅路が始まるかと思いきや、アニマルガールたちも加わって、大冒険になっちゃった！? (c)けものフレンズプロジェクトA,アニメ
