タイトル,あらすじ,ジャンル
鬼滅の刃,時は大正、日本。炭を売る心優しき少年・炭治郎は、ある日鬼に家族を皆殺しにされてしまう。さらに唯一生き残った妹の襧豆子は鬼に変貌してしまった。絶望的な現実に打ちのめされる炭治郎だったが、妹を人間に戻し、家族を殺した鬼を討つため、“鬼狩り”の道を進む決意をする。人と鬼とが織りなす哀しき兄妹の物語が、今、始まる--！ ©吾峠呼世晴／集英社・アニプレックス・ufotable,アニメ
ワンピース,時は大海賊時代。かつて、この世の全てを手に入れた男がいた。その名は海賊王ゴールド・ロジャー。遥かな大海原グランドラインには、彼が遺した“ひとつなぎの大秘宝（ワンピース）”が隠されているという…。伝説の秘宝を求め、人々は競うように海へと漕ぎ出してゆく。そして、ここにもグランドラインを目指す者が一人。悪魔の実と呼ばれる不思議な実の一つ「ゴムゴムの実」を食べ、全身がゴムのように伸びるゴム人間になったモンキー・Ｄ・ルフィだ。幼い頃に赤髪のシャンクスから麦わら帽子を託された彼は、海賊王になるという壮大な野望を抱いていた。海へと乗り出したルフィは、航海の中で大冒険を繰り返し、様々な人々と出会ってゆく。信頼できる個性的な仲間、悪党どもや海軍など立ちふさがる強大な敵…さあ、まだ見ぬ世界へ向けて帆を上げろ！　歴史を変える大航海が今、出航の時を迎える!!(C)尾田栄一郎／集英社・フジテレビ・東映アニメーション,アニメ
ワンピース,時は大海賊時代。かつて、この世の全てを手に入れた男がいた。その名は海賊王ゴールド・ロジャー。遥かな大海原グランドラインには、彼が遺した“ひとつなぎの大秘宝（ワンピース）”が隠されているという…。伝説の秘宝を求め、人々は競うように海へと漕ぎ出してゆく。そして、ここにもグランドラインを目指す者が一人。悪魔の実と呼ばれる不思議な実の一つ「ゴムゴムの実」を食べ、全身がゴムのように伸びるゴム人間になったモンキー・Ｄ・ルフィだ。幼い頃に赤髪のシャンクスから麦わら帽子を託された彼は、海賊王になるという壮大な野望を抱いていた。海へと乗り出したルフィは、航海の中で大冒険を繰り返し、様々な人々と出会ってゆく。信頼できる個性的な仲間、悪党どもや海軍など立ちふさがる強大な敵…さあ、まだ見ぬ世界へ向けて帆を上げろ！　歴史を変える大航海が今、出航の時を迎える!!(C)尾田栄一郎／集英社・フジテレビ・東映アニメーション,アニメ
ドラゴンボール超,"ドラゴンボールの力によって""魔人ブウ”の記憶が人々から消え去り、さらに月日が流れた地球。悟空は、チチの言いつけで働くことになって農業をしつつもさぼりながら修業の毎日。そして結婚したての悟飯とビーデルは幸せな日々を過ごしていた。一方、宇宙の彼方では39年ぶりに目覚めた破壊神ビルスが、予知夢で見た自分のライバルになり得るであろう何者かの名前を思い出すべく奮闘していた。果たしてその者の名前は！？(C)バードスタジオ/集英社・フジテレビ・東映アニメーション",アニメ
ワンピース,時は大海賊時代。かつて、この世の全てを手に入れた男がいた。その名は海賊王ゴールド・ロジャー。遥かな大海原グランドラインには、彼が遺した“ひとつなぎの大秘宝（ワンピース）”が隠されているという…。伝説の秘宝を求め、人々は競うように海へと漕ぎ出してゆく。そして、ここにもグランドラインを目指す者が一人。悪魔の実と呼ばれる不思議な実の一つ「ゴムゴムの実」を食べ、全身がゴムのように伸びるゴム人間になったモンキー・Ｄ・ルフィだ。幼い頃に赤髪のシャンクスから麦わら帽子を託された彼は、海賊王になるという壮大な野望を抱いていた。海へと乗り出したルフィは、航海の中で大冒険を繰り返し、様々な人々と出会ってゆく。信頼できる個性的な仲間、悪党どもや海軍など立ちふさがる強大な敵…さあ、まだ見ぬ世界へ向けて帆を上げろ！　歴史を変える大航海が今、出航の時を迎える!!(C)尾田栄一郎／集英社・フジテレビ・東映アニメーション,アニメ
ハイキュー!!,"「週刊少年ジャンプ」で絶賛連載中・次世代王道スポーツ漫画、『ハイキュー!!』が早くもTVアニメ化！制作は、あのProduction I.G！ 想いをのせて仲間とボールを""繋ぐ”、それがバレーボール。少年たちの躍動感あふれる激闘を見逃すな！(C)古舘春一／集英社・「ハイキュー!!」製作委員会・MBS",アニメ
ハイキュー!!,"「週刊少年ジャンプ」で絶賛連載中・シリーズ累計1,300万部突破の次世代王道スポーツ作品、『ハイキュー!!』のTVアニメ続編が制作決定！3度のボレーで攻撃へと“繋ぐ”バレーボールに青春を燃やす少年たちの、チームメイトへの熱い思いと、ライバルとの死力を尽くす真剣勝負。本格バレーボール作品の魅力を、アニメーションならではの躍動感でお届けします！(Ｃ)古舘春一／集英社・「ハイキュー!!セカンドシーズン」製作委員会・MBS",アニメ
ワンピース,時は大海賊時代。かつて、この世の全てを手に入れた男がいた。その名は海賊王ゴールド・ロジャー。遥かな大海原グランドラインには、彼が遺した“ひとつなぎの大秘宝（ワンピース）”が隠されているという…。伝説の秘宝を求め、人々は競うように海へと漕ぎ出してゆく。そして、ここにもグランドラインを目指す者が一人。悪魔の実と呼ばれる不思議な実の一つ「ゴムゴムの実」を食べ、全身がゴムのように伸びるゴム人間になったモンキー・Ｄ・ルフィだ。幼い頃に赤髪のシャンクスから麦わら帽子を託された彼は、海賊王になるという壮大な野望を抱いていた。海へと乗り出したルフィは、航海の中で大冒険を繰り返し、様々な人々と出会ってゆく。信頼できる個性的な仲間、悪党どもや海軍など立ちふさがる強大な敵…さあ、まだ見ぬ世界へ向けて帆を上げろ！　歴史を変える大航海が今、出航の時を迎える!!(C)尾田栄一郎／集英社・フジテレビ・東映アニメーション,アニメ
東京喰種トーキョーグール,“ヒト”と変わらぬ姿をしながら“ヒト”の肉を喰らうことでしか生きながらえることができない存在“喰種（グール）”--。　彼らの脅威から人々を守るために設立された[ＣＣＧ]（喰種対策局）”で、“クインクス”と呼ばれるチームが結成された。彼らは特殊な施術により喰種の能力を持つようになったヒトで構成されており、メンターとしてチームを率いる佐々木琲世（ささき はいせ）には、なぜか２年前までの記憶がない。そして彼には、[ＣＣＧ]内ではよく知られた秘密があった。 (C)石田スイ／集英社・東京喰種:re製作委員会,アニメ
ワンピース,時は大海賊時代。かつて、この世の全てを手に入れた男がいた。その名は海賊王ゴールド・ロジャー。遥かな大海原グランドラインには、彼が遺した“ひとつなぎの大秘宝（ワンピース）”が隠されているという…。伝説の秘宝を求め、人々は競うように海へと漕ぎ出してゆく。そして、ここにもグランドラインを目指す者が一人。悪魔の実と呼ばれる不思議な実の一つ「ゴムゴムの実」を食べ、全身がゴムのように伸びるゴム人間になったモンキー・Ｄ・ルフィだ。幼い頃に赤髪のシャンクスから麦わら帽子を託された彼は、海賊王になるという壮大な野望を抱いていた。海へと乗り出したルフィは、航海の中で大冒険を繰り返し、様々な人々と出会ってゆく。信頼できる個性的な仲間、悪党どもや海軍など立ちふさがる強大な敵…さあ、まだ見ぬ世界へ向けて帆を上げろ！　歴史を変える大航海が今、出航の時を迎える!!(C)尾田栄一郎／集英社・フジテレビ・東映アニメーション,アニメ
キングダム,TVアニメの第2シリーズ。古代中国、春秋戦国時代の秦国。田舎村で下僕として暮らしていた少年、信の夢は、戦場に出て武功を上げ、いつか歴史に名を残す天下の大将軍になること。そして、先の戦で功績を上げた信は、ついに三百人将となった。そんな中、秦国の若き王、エイ政の号令の元、国の命運をかけた大戦が行われることに。そこで出会った同世代の若き将たちは互いに競い合い、時には協力しながらそれぞれの夢を掴み取るべく戦場を駆け抜ける。(C)原泰久・集英社／NHK・総合ビジョン・ぴえろ,アニメ
Dr.STONE,【最新話は一定期間後に順次プライム会員特典対象（見放題）となる予定です。】全人類が、謎の現象により一瞬で石化して数千年--。超人的な頭脳を持つ、根っからの科学少年・千空が目覚めた。文明が滅んだ石の世界(ストーンワールド)を前に、千空は、科学の力で世界を取り戻すことを決意。時を同じくしてよみがえった、体力自慢の幼馴染・大木大樹はじめ、仲間たちと、ゼロから文明を作り出していく--石器時代から現代文明まで、科学史200万年を駆け上がる！前代未聞のクラフト冒険譚(アドベンチャー)、ここに開幕！©米スタジオ・Boichi／集英社・Dr.STONE製作委員会,アニメ
ダンジョンに出会いを求めるのは間違っているだろうか,その街には多くの神々が住まい、その街の中心には地中奥深く--深淵へと至る『ダンジョン』が存在する。その街の名は迷宮都市オラリオ。女神ヘスティアと冒険者ベル・クラネルは、相も変わらず主神とたったひとりの眷族という最小構成。だが、世界最速のランクアップという偉業を成し遂げたベルには、これまでにないほどの視線が注がれ始めていた--迷宮・出逢い、そして冒険--これは再び綴られ始めた、──少年が歩み、女神が記す 【眷族の物語(ファミリア・ミィス)】──(c)大森藤ノ・SBクリエイティブ/ダンまち2製作委員会,アニメ
ダンベル何キロ持てる？,「ひびき……お前、また太った？」食べることが大好きな女子高生・紗倉 ひびき(さくら・ひびき)の心に突き刺さった友人の非情な一言。 夏休みまでに絶対に痩せてみせるとダイエットを決意したひびきだったが、 一人ではまともに運動も続けられない体たらく。こうなったらとひびきが足を運んだ先はトレーニングジムだった！ そして入会したジムで同級生のカリスマ美少女生徒会長・奏流院朱美(そうりゅういん・あけみ)と出会ったひびきは、深くて楽しい筋トレの世界へ足を踏み入れることに……。©2019 サンドロビッチ・ヤバ子，MAAM・小学館／シルバーマンジム,アニメ
はたらく細胞,人の細胞の数、およそ37兆個（新説）。細胞たちは体という世界の中、今日も元気に、休むことなく働いている。酸素を運ぶ赤血球、細菌と戦う白血球……そこには、知られざる細胞たちのドラマがあった。擬人化モノの新定番、大人気コミック「はたらく細胞」が待望のテレビアニメ化！誰もが共感できる、体内細胞擬人化ストーリー！(C)清水茜／講談社・アニプレックス・davidproduction,アニメ
炎炎ノ消防隊,全人類は怯えていた---。何の変哲もない人が突如燃え出し、炎を操る怪物“焰ビト”となって、破壊の限りを尽くす“人体発火現象”。炎の恐怖に立ち向かう特殊消防隊は、現象の謎を解明し、人類を救うことが使命！とある理由から“悪魔”と呼ばれる、新入隊員の少年・シンラは、“ヒーロー”を目指し、仲間たちと共に、“焰ビト”との戦いの日々に身を投じる！！ ©大久保篤・講談社／特殊消防隊動画広報課,アニメ
キングダム,紀元前、中国。時代は春秋戦国時代。西方の国、秦で戦災孤児として暮らしていた二人の少年、信と漂の夢は、日々鍛錬を積み、いつか戦で武功を立てて天下の大将軍になること。そんな二人にある転機が訪れる。王宮に仕える大臣、昌文君の目に留まった漂が王宮に召し上げられたのだ。だがほどなくして王宮の勢力争いに巻き込まれ大けがを負った漂が、命からがら故郷へと戻ってくる。そして漂から託された地図を頼りに訪れた村で信は、漂とうり二つの少年、政と出会う。この少年こそ秦王、エイ政…後の始皇帝であった。(C)原泰久・集英社／NHK・総合ビジョン・ぴえろ,アニメ
ドラゴンボールＺ,天下一武道会の壮絶な闘いから５年。大人になった孫悟空は、結婚したチチとの間に息子の悟飯をもうけ、平穏な日々を過ごしていた。だが、ある日突然、宇宙からやって来た謎の男によって、平和はもろくも崩れ去ってしまう。ラディッツと名乗る彼は、強靱な尻尾を持ち、悟空やクリリンさえも一撃で吹き飛ばしてしまうほどのパワーを持っていた。このラディッツこそ、惑星ベジータを出身地にもつ戦闘民族サイヤ人にして、星が滅亡した際に生き残った、孫悟空の実の兄だった！　ラディッツは力なき悟飯を人質に取り、自分たちの仲間に加わるよう悟空に迫る。サイヤ人の狙いは地球人を絶滅させ、星を我がものにすること。邪悪な野望に手を貸すことなど出来るはずがない。悟空は宿命のライバル・ピッコロとコンビを組み、ラディッツとの闘いに挑む！(C)バードスタジオ／集英社・東映アニメーション,アニメ
Re:ゼロから始める異世界生活,コンビニからの帰り道、突如異世界へと召喚されてしまった普通の男子高校生、菜月昴。右も左も分からない異世界に放り出され、途方に暮れていたスバルに手を差し伸べたのは美しい銀髪の少女だった。絶望から救ってくれた少女に何かお返しがしたいスバルは、少女が盗まれてしまった大切なものを一緒に探すことになるのだが……。(c)長月達平・株式会社KADOKAWA刊／Re:ゼロから始める異世界生活製作委員会,アニメ
新世界より,偽りの神に抗え。,アニメ
東京喰種トーキョーグール,「この世界は間違っている――」 東京に潜む『絶望』。 それは、人々に『死』以上の恐怖を与える怪人――“喰種”（グール）。 彼らはヒトに紛れ、ヒトを狩り、その死肉を喰らう。食物連鎖の頂点に君臨する“喰種”に怯えながら、人間たちはこの『間違った世界』を生きていた。 読書好きの大学生・カネキは、行きつけの喫茶店「あんていく」にて、リゼという少女に出会う。年齢や境遇、読書の趣味も同じという事で、急接近する二人だが…… 僕は小説の主人公でも何でもない… だけど…もし仮に僕を主役にひとつ作品を書くとすれば ――それはきっと、“悲劇”だ 『赫子』と呼ばれる捕食器官を用いて人間を襲い、その殺傷能力の高さから「化け物」と恐れられる“喰種”だが、彼らが生きる方法は、ヒトを喰う以外に存在しない。 カネキは、この歪んだ世界に疑問と葛藤を抱きながら、逃れようのない負の連鎖に巻き込まれていく。,アニメ
東京喰種トーキョーグール,――これは「絶望」に囚われた、青年の物語―― 人間の死肉を喰らう怪人“喰種”が潜む街――東京。 大学生のカネキは、ある事故がきっかけで“喰種”の内臓を移植され、半“喰種”となる。 人を喰らわば生きていけない、だが喰べたくはない。 人間と“喰種”の狭間で、もがき苦しむカネキ。 どちらの世界にも「居場所」が無い、 そんな彼を受け入れたのは“喰種”芳村が経営する喫茶店「あんていく」だった。 そしてカネキは自らが“喰種”と人間、ふたつの世界に「居場所」を持てる唯一人の存在であると知る。 互いが歪めた世界を正すため、カネキは“喰種”と人間の想いが交錯する迷宮へと立ち入るが…。,アニメ
魔王様、リトライ！,見た目は魔王、中身は一般人の勘違い系ファンタジー！大野晶は自身が運営する「GAME」内のラスボス「魔王・九内伯斗」にログインしたまま異世界へと飛ばされてしまう。そこで出会った片足が不自由な少女と旅を始めるが、圧倒的な力を持つ「魔王」の存在を周囲が放っておくことはなかった。魔王を討伐しようとする国や聖女から狙われ、一行は行く先々で様々な騒動を巻き起こすことに…！,アニメ
ありふれた職業で世界最強,【最新話は一定期間後に順次プライム会員特典対象（見放題）となる予定です。】“いじめられっ子”の南雲ハジメは、クラスメイトと共に異世界へ召喚されてしまう。つぎつぎに戦闘向きのチート能力を発現するクラスメイトとは裏腹に、錬成師という地味な能力のハジメ。異世界でも最弱の彼は、あるクラスメイトの悪意によって迷宮の奈落に突き落とされてしまい--!?脱出方法が見つからない絶望の淵のなか、錬成師のまま最強へ至る道を見つけたハジメは、吸血鬼のユエと運命の出会いを果たす--。「俺がユエを、ユエが俺を守る。それで最強だ。全部薙ぎ倒して世界を越えよう」奈落の少年と最奥の吸血鬼による“最強”異世界ファンタジー、開幕！--そして、少年は“最強”を超える。 ©白米良・オーバーラップ/ありふれた製作委員会,アニメ
あたしンち,“タチバナ家”は日本のどこにでも存在し、誰でもが共感できる、等身大の幸せな家庭。料理がヘタでなまけものの母、トイレのドアを開けっ放しにする父、ちょっとマヌケな女子高生の娘・みかん、一見クールな中学生の息子・ユズヒコ。家族みんなで楽しむことのできるアニメの決定版をお届けします。,アニメ
盾の勇者の成り上がり,ごく平凡なオタク大学生・岩谷尚文は、図書館で出会った1冊の本に導かれ異世界へと召喚されてしまう。与えられた使命は、剣、槍、弓、盾をまとう四聖勇者の一人「盾の勇者」として、世界に混沌をもたらす災い「波」を振り払うこと。大冒険に胸を膨らませ、仲間とともに旅立った尚文。ところが、出発から数日目にして裏切りに遭い、金も立場もすべて失ってしまう。他人を信じられなくなった尚文は奴隷の少女・ラフタリアを使役し、波に、世界に、立ち向かおうとするが-。果たして、この絶望的状況を打破することはできるのか?すべてを失った男の成り上がりファンタジー、開幕。©2019 アネコユサギ／KADOKAWA／盾の勇者の製作委員会,アニメ
スラムダンク,中学校三年間で50人もの女の子にふられ続けた悲しい男・桜木花道。50人目の女子生徒に「私、バスケット部の小田君が好きなの」と言われたショックが尾を引いて、湖北高校へ入学してからも“バスケット”という言葉に異常に反応し、立ち直れずにいた。そんなある日のこと、一人の美少女から声をかけられる。「バスケットはお好きですか？」彼女は晴子。たちまち恋に落ちた花道は、一緒に登下校する日を夢見てバスケットのトレーニングを始める。ところが、晴子はバスケ部のルーキー・流川楓に憧れていたのだ！天才を自称する花道は、バスケットボール部に入部。恋のライバルである流川や、晴子の兄でキャプテンの赤木たちに触発されながら、次第に成長していく。そして、天才・仙道をはじめとする様々なライバルたちとの激闘。彼らとしのぎを削り、目指せ、全国制覇！(C)井上雄彦・アイティープランニング・東映アニメーション,アニメ
ハイキュー!!,春の高校バレー宮城県大会・決勝戦。烏野高校排球部の前に立ちはだかるのは、絶対王者と呼ばれる白鳥沢学園高校。最強のスパイカー・牛島を前に、果たして勝機はあるのか!?全国大会出場へ向けた激闘がいま始まる――。(Ｃ)古舘春一／集英社・「ハイキュー!! 3rd」製作委員会・MBS,アニメ
女子高生の無駄づかい,浪費する、青春──。 WEBコミック誌「コミックNewtype」で大人気連載中の学園ガールズコメディが待望のTVアニメ化決定！ちょっと残念な女子が集う、さいのたま女子高校を舞台に、とてつもないバカ・田中(通称：バカ)、アニメや漫画を愛するオタク女子・菊池(通称：ヲタ)、いつも無表情でロボットのような少女・鷺宮(通称：ロボ)を中心に、個性豊かで魅力的な仲間たちが、女子高生というキラめきに溢れた青春を無駄に浪費していく抱腹絶倒のJK学園コメディが今、幕を開ける！ ©ビーノ／ＫＡＤＯＫＡＷＡ／女子高生の無駄づかい製作委員会,アニメ
『ワンパンマン』第2期,趣味でヒーローを始めた男、サイタマ。3年間の特訓により無敵のパワーを手に入れ、あらゆる敵を一撃（ワンパン）で倒すヒーローである。ひょんなことから弟子となったジェノスと共にヒーロー協会で正式なヒーロー活動を開始する。怪人発生率が異常に高くなる中、大予言者シババワが遺した「地球がヤバい」予言を受けて、対策に乗り出そうとするヒーロー協会。そこにヒーロー狩りのガロウが現れる。 ©ONE・村田雄介／集英社・ヒーロー協会本部,アニメ
ダンジョンに出会いを求めるのは間違っているだろうか,迷宮都市オラリオ──『ダンジョン』と通称される壮大な地下迷宮を保有する巨大都市。未知という名の興奮、輝かしい栄誉、そして可愛い女の子とのロマンス。人の夢と欲望全てが息を潜めるこの場所で、少年は一人の小さな「神様」に出会った。「よし、ベル君、付いてくるんだ! 【ファミリア】入団の儀式をやるぞ! 」「はいっ! 僕は強くなります! 」どの【ファミリア】にも門前払いだった冒険者志望の少年と、構成員ゼロの神様が果たした運命の出会い。これは、少年が歩み、女神が記す、── 【眷族の物語(ファミリア・ミィス)】──(c)大森藤ノ・SBクリエイティブ/ダンまち製作委員会,アニメ
彼方のアストラ,宇宙への往来が当たり前になった近未来で、9名の少年少女たちが惑星キャンプへと旅立つ。宇宙旅行に胸を躍らせながら出発した彼らを待ち受ける、予想外の事態とは……！？「マンガ大賞2019」大賞を受賞！『SKET DANCE』の篠原健太が描く大人気SFサバイバルストーリーが待望のTVアニメ化決定！ ©篠原健太／集英社・彼方のアストラ製作委員会,アニメ
