タイトル,あらすじ,ジャンル
魔法少女サイト,どうやらそのサイトは不幸な人間しか出会えないらしい。 だから彼女たちは選ばれた--。 どこにも居場所のない彼女は、いつも死ぬことばかり、考えている。 学校ではクラスメイトからのいじめを受け、家では実の兄からの虐待に耐える日々。 朝霧 彩。中学２年生。14歳。 ある日、彼女は不気味なWEBサイト「魔法少女サイト」と出会い、 魔法の力を秘めた”ステッキ”を手に入れる。 彩は魔法の力を手に入れたことで、同じくステッキを持つクラスメイトの奴村露乃、 そしてほかの“魔法少女”とともに、苛烈な運命に巻き込まれてしまう。 これは、魔法の力を手に入れた不幸な少女たちの、 友情と青春、そして運命を変える戦いの記録。,アニメ
ReLIFE,無職でニートの海崎新太（27歳）はリライフ研究所の社会復帰プログラム「リライフ」へ参加し、1年間限定で高校生として高校に通っていた。2学期に入り日代と一緒に青葉祭の実行委員を任 された海崎は日代にある気持ちを抱く。一方、日代も花火大会以降、海崎を意識するがその気持ちが何なのか整理がつかないでいた。そんな二人に「リライフ」が終了するタイムリミットの卒業式が迫っていた。(C)夜宵草/comico/リライフ研究所,アニメ
上野さんは不器用,最新話は一定期間後に順次プライム会員特典対象（見放題）となる予定です。ココは、とある中学校の理科室━━━━。科学部部長の上野さんは、部活の後輩・田中に恋する乙女。天才的すぎる奇想天外な発明品を使って、あの手この手で気を引くためのアピール試みる。1年生部員の山下も冷静沈着なアシストで上野さんをバックアップ！果たして上野さんの恋は成就するのか！？それとも・・・© tugeneko・白泉社／上野さんは不器用製作委員会,アニメ
Fairy gone フェアリーゴーン,かつて妖精は、“兵器”だった-。 この世界には、動物に憑依することで不思議な力を宿す妖精が存在していた。 妖精が憑依した動物の臓器を摘出し、人間に移植することで、妖精を分身として出現させ、兵器として扱えるようになる。 妖精を戦争の道具として自在に操る兵士たち、彼らは『妖精兵』と呼ばれた。 だが、長きにわたる戦争が終結すると、彼らはその役目を果たし、行き場を失ってしまう。あるものは政府に、あるものはマフィアに、あるものはテロリストに、 それぞれの生きる道を選択していった。 戦争から9年の歳月が経つ。 未だ不安定な政治情勢の中、戦争によって受けた傷や過去を持つ犯罪者が現れ、 復讐のためテロを起こすようになっていた。 主人公の少女マーリヤは、ある事件に関わった事から妖精に関連する事件を捜査・鎮圧する違法妖精取締機関『ドロテア』に入隊することとなる。,アニメ
みんなのどうよう,日本コロムビアが105年の歴史の中で育ててきた定番の「どうよう」音源を使用し、「ドラえもん」、「クレヨンしんちゃん」の制作で知られるシンエイ動画が、書き下ろしのアニメーションを製作した、文部科学省 選定作品オリジナル・ミュージック・アニメーション第一弾。(C)シンエイ動画・日本コロムビア,アニメ
トリニティセブン,「傲慢(ごうまん)」「嫉妬(しっと)」「憤怒(ふんど)」「怠惰(たいだ)」「強欲(ごうよく)」「暴食(ぼうしょく)」「色欲(しきよく)」それは、王立ビブリア学園に君臨する、7人の少女にかせられた罪(テーマ)。世界を取り戻すため、少年はこの罪(テーマ)を支配することを決断した--その少年、春日アラタの知る日常は、「崩壊現象」と呼ばれる不可思議な事件によって、従姉妹の聖ごと異空間に消えてしまった。崩壊現象を解明し、聖を取り戻すため、王立ビブリア学園に入学したアラタ。そこに待っていたのは、テーマにより魔道を操る７人の少女たちだった。©サイトウケンジ・奈央晃徳／ＫＡＤＯＫＡＷＡ／トリニティセブン製作委員会,アニメ
のんのんびより りぴーと,「旭丘分校」の生徒はたった5人。学年も性格も違うけれど、お花見をしたり、川で遊んだり、いもほりをしたり、かまくらを作ったり・・・いつも一緒に春夏秋冬の変わりゆく田舎生活を楽しんでいます。穏やかで何気ないけれど、笑えて、ほろっとして、心があたたかくなる。そんなゆるやかでやさしい時間が再びはじまります。(C)2015 あっと・KADOKAWA刊/旭丘分校管理組合二期,アニメ
天保異聞 妖奇士,時は天保十四年。江戸の町を異界の獣「妖夷（ようい）」が襲う。それに立ち向かうは「蛮社改所（ばんしゃあらためしょ）」のメンバーたち。記憶を失った男や、山で育った男、男装の少女など得体は知れないが、それぞれに妖夷を討つための特別な力を有している。彼らに与えられたコードネームは「奇士（あやし）」――。(c) 會川昇・BONES／毎日放送・アニプレックス・電通,アニメ
「終物語」まよいヘル／ひたぎランデブー／おうぎダーク,臥煙伊豆湖の振るう怪異殺しに切り刻まれ、阿良々木暦は死んだ――だが死んだはずの暦は、とある場所で目を覚ます。そこにいたのは、成仏したはずの八九寺真宵だった。不思議がる暦に、彼女はこう告げた。「ここはですね――阿良々木さん。地獄です」そして暦は自分が死んだ意味を知る。　阿良々木暦が「何」でできているかを知る物語にして、すべての「始まり」を知る物語は、ここに締めくくられる――(C)西尾維新／講談社・アニプレックス・シャフト,アニメ
将国のアルタイル,ここではない世界、いまではない時代。 将軍と呼ばれる為政者たちの治める草原と砂漠の国・トルキエ将国。 12年前、隣国・バルトライン帝国との戦争で母を失ったマフムートは、 平和な国にしたいと希い、トルキエ史上最年少で将軍となった。 しかし、交易で得た巨万の富をもって安寧を取り戻したトルキエに対して、再び帝国の侵略が始まる。 犬鷲・イスカンダルを相棒に国家間に渦巻く陰謀と策略を切り裂かんと動くマフムートは、いかにして自分の国を平和へと導くのか？ ---理想と現実の狭間で彼のとる行動とは…？ (C)カトウコトノ・講談社／将国のアルタイル製作委員会,アニメ
若おかみは小学生！,事故で両親を亡くし、おばあさんの温泉旅館「春の屋」で暮らすことになった小学6年生の女の子・おっこ(関織子)。ユーレイのウリ坊やライバルの真月に助けられながら、次々とやってくる変わったお客様をもてなすために、若おかみとして毎日奮闘中！！,アニメ
アンゴルモア元寇合戦記,時は文永11年（1274年）。 鎌倉武士・朽井迅三郎はある事件により、罪人として対馬へ流刑となる。 島を治める地頭代の娘・輝日は、対馬へたどり着いた流人たちに、 蒙古の大軍勢が対馬へ迫っていることを伝え、ある命令を下す。 「さぁ、お前たち。この対馬のために、死んでくれ」 死罪となる代わりに捨て石となれと命じられ、 是非も無い流人たちは、蒙古軍との戦いへ身を投じる。 怯むことなく対馬勢を率いて立ち向かう迅三郎。 島民を鼓舞し勇気づける宗家一門と輝日。 古来より対馬を守り続ける刀伊祓たち。 太宰府からの援軍が到着するまで、 迅三郎たち対馬勢は、蒙古軍の猛攻を防ぎきることができるのか？ 全てを失い、流された率土の地・対馬で 一所懸命という志のもと、諦めない勇者たちが挑む七日間の戦いが始まる--！,アニメ
こみっくがーるず,萌田薫子（P.N.かおす）15歳。職業高校生、そして4コマまんが家！まんが家専用の女子寮に引っ越してきた彼女は、同室の少女まんが家の小夢やTLまんが家の琉姫、少年まんが家の翼といった仲間に囲まれて、今日も楽しくネームにペン入れ、仕上げ作業に徹夜作業！かわいくて面白い、まんが家寮生活が始まります© はんざわかおり・芳文社／こみっくがーるず製作委員会,アニメ
ラブライブ！サンシャイン!!TVアニメ2期,静岡県沼津市の海辺の町、内浦にある私立浦の星女学院。駿河湾のかたすみにある小さな高校で2年生の高海千歌を中心とした9人の少女たちが、大きな夢を抱いて立ち上がる。それは、キラキラと輝く“スクールアイドル”になること！ 諦めなければきっと夢は叶う――。いまはただ輝きを目指して、がむしゃらに駆け抜けていこう！ ここから彼女たちの「みんなで叶える物語（スクールアイドルプロジェクト）」が始まった！(C)2017 プロジェクトラブライブ！サンシャイン!!,アニメ
いぬやしき,※本編には一部の視聴者様には不快に感じるおそれのある刺激的な描写を含む可能性があります。定年を間近に迎える冴えないサラリーマン・犬屋敷壱郎は会社や家庭から疎外された日々を送っていたが、ある日突然、医者から末期ガンによる余命宣告を受け自暴自棄になる。 その晩、突如飛来したUFOの墜落に巻き込まれ機械の体に生まれ変わった彼は人間を遥かに超越する力を手に入れることに。 一方、同じ事故に遭遇した高校生・獅子神皓は、手に入れた力を己の思うがままに行使し始めていた。 自分の意に背く人々をただただ傷付けていく獅子神と、獅子神によって傷付けられた人々を救い続ける犬屋敷。 人間の本質は善なのか、それとも悪なのか…？ 強大な力を手に入れた２人が、いま、それぞれの想いで動き出す--。(C)奥浩哉・講談社／アニメ「いぬやしき」製作委員会,アニメ
スパイシーボーイ,スパイシーボーイと呼ばれるロボットのトムと天才発明少年マキオの物語。アメリカンアニメの空気感と個性的なキャラクター、わかりやすいストーリーのカートゥーンチックなアニメーション。,アニメ
邪神ちゃんドロップキック,魔界の悪魔、通称「邪神ちゃん」は、ある日突然人間界に召喚されてしまう。彼女を召喚したのは、神保町のボロアパートで暮らすちょっとブラックな心を持つ女子大生「花園ゆりね」。「邪神ちゃん」を召還したものの彼女？を魔界に帰す方法がわからない。仕方なく一緒に暮らし始めた邪神ちゃんと「ゆりね」だが、「邪神ちゃん」曰く、「召喚者が死ねば魔界に帰れる」。そこで邪神ちゃんがとった行動とは……!? ひとりの少女と悪魔「邪神ちゃん」が繰り広げる、ちょっときキケンな同居生活コメディ！,アニメ
GRANBLUE FANTASY The Animation,ここは、空に多くの島が漂う、空の世界。神秘を奉る島ザンクティンゼルに暮らす少年・グランと一緒に暮らす相棒のビィは、ある日、空から落ちてきた少女・ルリアと出会う。ルリアは、この空の世界を強大な軍事力によって支配しようとする軍事国家・エルステ帝国から逃れてきたのだった。グランとルリアは、帝国から逃れるため、そしてグランの父が残した「星の島イスタルシアで待つ」という手紙を手に、壮大な空へと旅立つ。(C) アニメ「グランブルーファンタジー」製作委員会,アニメ
デンキ街の本屋さん,マンガを愛する書店員たちの赤面青春★ラブコメディ！！「コミック専門店　うまのほね」そこではみんな何かのマニアだったり、コアなファンだったりと濃い目のキャラ多し。新刊を並べたり、シュリンク掛けたり、女子力の低さに戦慄したり、エロ本大好き人間なのかと問い正したりと、真面目（？）に楽しく働きつつ、あだ名で呼び合う男子と女子の仲も急接近しちゃったり！？イってるギャグと胸キュンな恋愛模様が止まらない、書店青春ラブコメ！(C)２０１４水あさと／株式会社KADOKAWA メディアファクトリー刊／コミックうまのほね,アニメ
パズドラ,「パズドラ」の大会会場の一角にある屋台に、鮮やかな手つきでたこ焼きを作る少年「明石タイガ」がいた。そんなタイガの前にモンスターの「トラゴン」が現れ、パズドラのパートナーに指名される。店の宣伝になると考えたタイガは、トラゴンとともにエキシビジョンマッチに出ることに。パズドラに魅入られた少年が世界一のプロゲーマーを目指す物語、ここに開幕！©ガンホー・オンライン・エンターテイメント／パズドラプロジェクト・テレビ東京,アニメ
ブギーポップは笑わない,最新話は一定期間後に順次プライム会員特典対象（見放題）となる予定です。ぼくは自動的なんだよ。名を不気味な泡（ブギーポップ）という--。エンタテインメントノベルでNo.1シェアを誇るレーベル・電撃文庫に多大な影響を与えた、今なお色褪せることのない名作として、絶大な支持を集める人気タイトル「ブギーポップは笑わない」シリーズが、刊行から20年の節目で待望のTVアニメ化！©2018 上遠野浩平／ＫＡＤＯＫＡＷＡ　アスキー・メディアワークス／ブギーポップは笑わない製作委員会,アニメ
TVアニメ「ペルソナ４」,「ねぇ、マヨナカテレビって知ってる？」家庭の事情で都会から叔父の住む稲羽市へと越してきた鳴上悠。閑散とした町並み、寂れた商店街、若者たちの集まる大型ショッピングモール……。穏やかな時間の流れる田舎町で八十神高校の新しいクラスメイト達と過ごす生活が始まる。しかし転校初日の朝、市内でとある女子アナウンサーの遺体がテレビアンテナに吊るされた状態で発見される。町を覆う原因不明の霧と、若者達の間で囁かれている「マヨナカテレビ」の噂。雨の夜の午前０時、消えているテレビをひとりで見ると画面に映るという自分ではない別の人間の正体とは……。個性豊かな友人たちと過ごす日々の中、徐々に迫りくる異変は、果たして何をもたらすのか--？(C)ATLUS (C)SEGA/「ペルソナ４」アニメーション製作委員会,アニメ
ストライクウィッチーズ 501部隊発進しますっ！,※最新話は一定期間後に順次プライム会員特典対象（見放題）となる予定です。人類の防衛線『第501統合戦闘航空団』に宮藤芳佳が入隊！・・・しかし、肝心の敵・ネウロイはなかなかやってこず、戦闘ではなく炊事洗濯の毎日に追われる日々。個性的な隊員たちに振り回されたり、ツッコミを入れたり、フォローしたりと、そんな芳佳と愉快な魔女（うぃっち）達のおかしな日常が始まる！©2019 島田フミカネ・藤林真・KADOKAWA／501部隊発進しますっ！,アニメ
TVアニメ「いつだって僕らの恋は10センチだった。」,桜丘高校の入学式。合田美桜と芹沢春輝は桜の樹の下で出会う。「美しい桜って書いて、美桜」「俺は春輝。春が輝く」春生まれの二人は親近感を覚える。それ以来、気づいたらお互い目で追うようになっていた。美術部の美桜は大人しく、映画研究部の春輝は快活で周りにはいつも誰かがいた。二人は全く違うタイプだが、いつの間にか一緒に下校する仲になっていた。付き合っていると勘違いされることもあるが、ずっと友達以上恋人未満の関係。本当はお互いに「好き」という気持ちを抱えながら─。いつも帰り道に寄る高台の階段に腰をかける二人。「春輝君って、好きな人とか、いる？」思わず聞いてしまった美桜に答える春輝。「好きなやつ、いるよ。…美桜は？」二人のその手の距離は10センチ。たった10センチなのに、その距離が縮まらない─。 (C)HoneyWorks／「僕10」製作委員会,アニメ
笑ゥせぇるすまんNEW,「ホーッ、ホッホッホッホッ」あの怪人・喪黒福造が帰って来くる―。藤子不二雄（A）による大人気ブラック・ユーモア漫画『笑ゥせぇるすまん』が、2017年4月、原作の雰囲気はそのままに、オリジナル脚本も交えた1話完結のオムニバス形式のテレビアニメで復活！！ストレス社会に生きる現代人の心の闇と欲求、人間の本質である弱さ、愚かさなど誰もが”ドキッ！”とする悩みを抱えた個性的なゲストキャラクターが毎話登場。実力派スタッフ＆キャストがブラック・ユーモアたっぷりにみなさんのココロのスキマをお埋めします！！(C)藤子スタジオ／笑ゥせぇるすまんＮＥＷ製作委員会,アニメ
やがて君になる,最新話は一定期間後に順次プライム会員特典対象（見放題）となる予定です。※最新話は一定期間後に順次プライム会員特典対象（見放題）となる予定です。　　人に恋する気持ちがわからず悩みを抱える小糸侑は、中学卒業の時に仲の良い男子に告白された返事をできずにいた。そんな折に出会った生徒会役員の七海燈子は、誰に告白されても相手のことを好きになれないという。燈子に共感を覚えた侑は自分の悩みを打ち明けるが、逆に燈子から思わぬ言葉を告げられる──「私、君のこと好きになりそう」　©2018 仲谷 鳰／ＫＡＤＯＫＡＷＡ／やがて君になる製作委員会,アニメ
八月のシンデレラナイン,市立里ヶ浜高校に通う有原翼は、野球部のないこの学校に「女子硬式野球部」を立ち上げる。 そこに集うのは、野球にはじめて触れる少女や、一度はプレーをあきらめた少女、高い壁に挑み続ける少女……。 時にぶつかり、競い、支え合って、里高女子野球部は青春を駆け抜ける！ 世界で一番あつい夏がはじまる-- (C)Akatsuki Inc./アニメ「八月のシンデレラナイン」製作委員会,アニメ
ジャングルはいつもハレのちグゥ,ジャングルの村に母親・ウェダと暮らす少年ハレ。だが、ハレや村の人々は、食料の獲得こそ狩猟採集だが、価値観は都会人と変わらず、丸太小屋の中には、テレビもゲーム機もある暮らしをしていた。そんなハレの前に、現れた美少女グゥ。見た目は人間でも中身はバケモノ。出会いがしらグゥに丸呑みにされたハレは、その体内に異世界が広がっているのを体験する。しかもそこに暮らす人々までいるのだ。吐き出されて戻ったハレは、自分にだけ本性を見せ、それ以外の人々には可愛い少女に見えるグゥと一緒に暮らすことになる。グゥの魔の手から村人を守ろうと、人知れず気苦労を重ねるハレの毎日が始まった――！,アニメ
遊☆戯☆王ARC-Ⅴ,物語の舞台は海岸沿いにある「舞網市(まいあみし)」。 デュエルの技術が突出して進歩している。その理由は赤馬零児が社長を務めるレオ・コーポレーションの存在。 同社が開発した「質量を持つ立体幻影(ソリッド・ビジョン)」の普及により、舞網市で「アクションデュエル」が生まれ、世界中で人気を博している。 子供たちはスター的存在であるプロデュエリストに憧れ、主人公・遊矢たちが通う「遊勝塾」や最大手「LDS(エルディーエス)」といった大小さまざまな規模の塾に通い、召喚法やデュエルスタイルなどを学んでいる。 そんなある日、遊矢はプロデュエル界の現役チャンピオンとエキシビジョンマッチで戦うことになるのだが……？(c)高橋和希 スタジオ・ダイス／集英社・テレビ東京・ＮＡＳ,アニメ
エウレカセブンＡＯ,沖縄の離島・磐戸島で老医師・トシオと共に島で暮らしていた少年“アオ”は中学校の入学式を目前に控えていた。そこへ突如現れた謎の存在“シークレット”は、島に出現した“スカブコーラル”を狙い容赦のない攻撃をしかけてくる。巨大なモンスターを前に為す術もない島民たちは、混乱に陥り逃げ惑うことしか出来なかった。 “アオ”は、島を守りたい一心で、偶然手にした鍵を使い日本軍の輸送艦に積まれていた軍用FPを起動させる。それはかつて“ニルヴァーシュ”と呼ばれたIFOだった……！(C)2012 BONES/Project EUREKA AO・MBS,アニメ
カーパトロールル,カーパトロールのメンバーのパトカーのマットと、消防車のフランクが、困ってる車やトラックを助けに行きます！ みんなの安全を守るため、カーパトロールはいつだって助けてくれます。カーシティの真のヒーローです！,アニメ
デート・ア・ライブⅢ,最新話は一定期間後に順次プライム会員特典対象（見放題）となる予定です。人類は『空間震』と呼ばれる新たな災害に見舞われていた。空間を揺るがし、あらゆるものを破壊し尽くすその災厄は、精霊と呼ばれる存在が隣界から顕現することにより発生するものだった。空間震を止め、災厄を人類から退けるために必要とされる措置は、武力をもって精霊を殲滅する、もしくは--『デートしてデレさせる』！精霊をデレさせ、更に『キス』をすることでその力を封印できる--そんな能力を持っている高校生・五河士道。人類の平和のため、なにより精霊たちを救うため--士道は彼女たちとの『デート』に奔走する。士道に心を開いた精霊・十香、四糸乃、琴里、耶具矢、夕弦、美九。精霊を殲滅するべく動く＜ＡＳＴ＞。精霊を利用せんとする＜ＤＥＭ＞。精霊との対話を試みる＜ラタトスク＞。そして、デレさせるべき新たな精霊--すべてを巻き込み、新たな戦争＜デート＞が始まる--,アニメ
鬼平,時は江戸後期。暴虐の限りを尽くす盗賊たちが、「鬼」と呼んで畏れる男がいた。「鬼の平蔵」こと火付盗賊改方ひつけとうぞくあらためかた・長谷川平蔵その人である。火付盗賊改方とは、一種の特別警察。江戸市中内外の犯罪を取り締まるだけでなく、他国に出て犯罪者を捕らえることもできる機動性の高い組織。しかし平蔵は職務に忠実なだけの固い男ではない。時として罪を犯した者にも情けをかけることがある。平蔵が許さないのは、非道。《盗人三箇条》--殺さず、犯さず、盗まれたら潰れるような店からは盗まない--から外れ、人の道に背く者には一切容赦はしない。男気と人情にあふれ、毅然としながらもどこか色気を漂わせた佇まいで人を惹きつけるオトナ。そんな平蔵と彼を取り巻くクセのあるキャラクターたちが、江戸にはびこる非道を追い込み、叩き潰す。（C）オフィス池波/ 文藝春秋/ 「TVシリーズ鬼平」製作委員会,アニメ
オヨネコぶ～にゃん,黄色い毛皮の太ったネコが、捨てネコから突然押しかけペットとなってゆでた家に住みついてしまった。その態度はとてもネコには見えない。人と話すことができるほど賢いが、性格は図々しく怠惰で意地汚い。こんな風変わりなオヨヨとゆでた家の長女たまごやその友人達が毎回騒動を起こすギャグ作品。,アニメ
