タイトル,あらすじ,ジャンル
四月は君の嘘,「14歳の春--僕は、君と走りはじめる」 からっぽになった少年が一人の少女と出逢う。少女の、自由で情熱的な音楽の調べが、少年の止まっていた時間を突き動かす。 11歳の冬--早熟の天才ピアニスト・有馬公生は母親を失ったショックから演奏をするとピアノの音が聴こえなくなるというトラウマを背負ってしまう。以来、少年は次第にピアノから遠ざかっていく。 ピアノと母親を失った彼の日常はモノトーンのように色をなくしてしまっていた。 そんなある日、公生を子供の頃から見てきた幼なじみ澤部椿は、あるクラスメイトを紹介する。 クラスメイトの名前は宮園かをり。 彼女はコンクールに出場するヴァイオリニストだった。楽譜を超え、自分なりのスタイルで課題曲を演奏するかをり。その奔放な演奏を見て、モノトーンだった公生の世界がカラフルに色づきはじめる。（C）新川直司・講談社／「四月は君の嘘」製作委員会,アニメ
弱虫ペダル GRANDE ROAD,総北高校に入学した、アニメやフィギュアが大好きなオタク少年・小野田坂道。同じく新入生で中学時代から自転車レーサーとして名を馳せた今泉俊輔と鳴子章吉との出会いをきっかけに、坂道は自転車の楽しさを知り、自転車競技部に入部する。めきめきと才能を伸ばしていった坂道は全国大会＜インターハイ＞のメンバーに選出される。全国の強豪校が揃う、３日間に及ぶ過酷な戦いに挑む総北。3校同着という波乱の結果となったインターハイ1日目。そして、それぞれが決意を新たにスタートラインに立ったインターハイ2日目。総北はアクシデントに見舞われ、そして箱根学園と京都伏見高校の走りに劣勢を強いられるも、全員の力で両校を追い上げていく。そして、2日目のゴールを獲るべく、それぞれのチームの“エース”が動き出す！(C)渡辺航（週刊少年チャンピオン）／弱虫ペダルGR製作委員会,アニメ
しまじろうのわお！,「しまじろう」と愉快な仲間たちが「ちゃれんじ島」で展開する、冒険あり、ファンタジーありの物語。日常生活で起こる様々な出来事、行動を通して、たくさんのことを学んでいきます。©Benesse Corporation,アニメ
サクラクエスト,主人公、木春由乃（こはるよしの）は、田舎から上京し短大の卒業を間近に控えた、いわゆる普通の20歳の女の子。東京には何でもあって、きっと特別な何かになれるのではないかと夢みて、30社以上の面接を受けるも、未だに内定はない。銀行の残高は980円。このままでは、田舎帰って普通のおばさんになってしまう・・・と葛藤していたそんなある日、以前、一度だけ働いたことがある派遣事務所から、「地域の町おこしの一環で国王をやってほしい」との依頼がある。よくわからないが軽い気持ちで依頼先の間野山市に向かうことにした。一時的に日本中でブームになるも、バブル崩壊に合わせて今ではほとんど見ることの無くなったミニ独立国。間野山市は、今なおミニ独立国を続けている、廃れた残念観光地だった。そんなこんなで、由乃の”普通じゃない”お仕事生活がはじまった。(C)2017サクラクエスト製作委員会,アニメ
妖怪ウォッチ！,「妖怪ウォッチ」+「！」=何が起きるかわからない！？あのケータと妖怪たちが帰ってきた！フツーの小学5年生『天野景太（ケータ）』と妖怪の『ウィスパー』や『ジバニャン』たちが繰り広げる、ドタバタ楽しくて、ちょっぴり奇妙な物語が、新要素満載で帰ってきた！新たな妖怪不祥事案件！　新たなともだち妖怪！　新たなコーナー目白押し！『妖怪アーク』に『ワンチャンサイド』！？いろんな「！」から目が離せない！妖怪ウォッチ！」で今日も妖怪、新発見！！！！！©LEVEL-5/妖怪ウォッチプロジェクト・テレビ東京,アニメ
サザエさん,初配信！なつかしのサザエさんに会おう！お宝映像どど～んと一挙公開！ アニメ『サザエさん』が生まれたのは、昭和44（1969）年10月5日。フジテレビで第１回放送が始まりました。番組開始当初はドタバタ喜劇の色合いが濃く、画風も現在のものとはかなり異なっていました。いつの時代も明るく楽しいサザエさん一家。お子さんからお年寄りまで、みんなが一緒に楽しめるアニメ『サザエさん』を、お茶の間にお届けします！ ※作品が制作された当時の時代的背景を考慮尊重し、本編は作品完成時の原版の通り配信しております。但し、現存するフィルムの状態や諸事情を鑑み、当時の映像とは異なる部分があることをご了承ください。 （C）長谷川町子所美術館,アニメ
機動戦士ガンダムSEED HDリマスター,コズミック・イラ70。「血のバレンタイン」の悲劇によって、地球、プラント間の緊張は一気に本格的武力衝突へと発展した。戦局は疲弊したまま、既に11ヶ月が過ぎようとしていた。そんな中、敵同士になった少年たちの邂逅は、やがて彼らが進むべき未来を示し始める。福田己津央、平井久司らが挑む、新たなるガンダム。※各話の初公開日は本作品の第1話の放送開始日となります。(C)創通・サンライズ,アニメ
ご姉弟物語,東京・下町で人々に愛されながら二人で生きる幼いご姉弟、おねいと純一郎。 ご両親は留守がちで、お母さんの友だちや、ご近所のみんなに育てられているみたい。 彼らの周りでは、時間は黄河のようにゆったり進む。そして姉弟は、今日もきっとどこか予想もつかないところで遊んでいるはず！ 双子の姉・おねいと弟・純一郎の日常や商店街の人々との交流を描くコメディアニメ。(C)安達哲・講談社／テレビ朝日・シンエイ・ADK,アニメ
タッチ,"上杉達也と和也は双子の兄弟。お隣の浅倉家に生まれた南とは、小さな頃からいつも一緒。あまりにも仲良く、元気なのに手を焼いた（？）親たちは共同出費で子供たちのために、３人で学び遊べる家まで建ててしまった。ところが、彼らも中学生に入る頃から、この""男２人+女１人""という状況の持つ意味を、それなりに意識し始めた。周囲は明るく可愛い南、成績優秀の和也を似合いのカップルと思っている。それに反し、兄の達也はだれもが認める""出がらし""。成績、スポーツ共に、和也に比べて数段見劣りするのだ。だが努力することは嫌いでも、その隠れた才能を見抜いてるのが和也。しかしいつも達也に反発しながらも、内心は彼にまんざらではないようすの南に、和也も気が気ではなくなって・・・。© あだち充／小学館・東宝・ADK",アニメ
僕だけがいない街（フジテレビオンデマンド）,『あの日、彼女は死んだ。』 自分だけ時が巻き戻る現象“再上映（リバイバル）”に悩まされる青年・藤沼悟が、自らの過去と対峙し、もがく姿を描く“時間逆行”サスペンスとして各界から熱い注目を浴びる『僕だけがいない街』がついにアニメ化！ （C）2016 三部けい／KADOKAWA／アニメ「僕街」製作委員会,アニメ
魔法使いの嫁,羽鳥チセは15歳の少女。彼女は帰れる場所も、生きる理由も、そのための術も、何も持ち合わせていない。ただひとつ、生まれ持った特別な力を除いて。そんなチセを弟子として、そして将来の花嫁として迎え入れたのは、異形の魔法使い・エリアス。悠久の時を生きる魔法使いの暮しの中で、チセは大切な何かを少しずつ取り戻していく…。これは、世界の美しさを識る為の物語。,アニメ
デスマーチからはじまる異世界狂想曲,デスマーチ真っ最中のプログラマー“サトゥー”こと鈴木一郎。仮眠を取っていたはずが、気が付くと異世界に…!?視界の端には、仮眠前に作っていたゲームを思わせるメニュー画面。レベル１の初期状態。ただし初心者救済策として実装したばかりの「全マップ探査」とマップ殲滅ボム「流星雨」×３付。目の前には蜥蜴人の大軍が!助かるために「流星雨」を使用したサトゥーは、その結果レベルが310となり莫大な財宝を手に入れる-。夢か現か、ここにサトゥーの旅が始まる!© 愛七ひろ・shri・ＫＡＤＯＫＡＷＡ カドカワBOOKS刊／デスマ製作委員会,アニメ
弱虫ペダル NEW GENERATION,全国大会＜インターハイ＞において、チーム全員の力で王者・箱根学園ら強豪たちを破り、みごと総合優勝を勝ち取った総北高校自転車競技部。熱い夏が終わり、金城、巻島、田所の3年生が引退を控え、1年生ながらインターハイで活躍した小野田坂道、今泉俊輔、鳴子章吉と、新主将の2年生・手嶋純太と副主将の青八木一らは“新チーム”として、インターハイ連覇をめざして始動する。王座奪還を目指し新たなメンバーを加えこちらも新チームとして動き出すライバルの箱根学園。怪物レーサー・御堂筋翔率いる京都伏見高校。全国の強豪たちもインターハイの頂点を目指して走りを磨く。新たな仲間、新たなライバル、そして新たな戦い…。男たちの熱きドラマが幕を開ける！(C)渡辺航（週刊少年チャンピオン）／弱虫ペダル03製作委員会,アニメ
はなかっぱ,緑いっぱいのやまびこ村に、頭に花が咲いているかっぱの家族が住んでいます。 おじいちゃんの頭には、「はす」 おばあちゃんの頭には、「かすみそう」 お父さんの頭には、「ひまわり」 お母さんの頭には、「たんぽぽ」 そして、はなかっぱには、「とりあえずの花」が咲いています。 大人になるまで、いろいろな花を咲かせるのです。 はなかっぱが咲かせる花の中でも、若返りの花と伝えられる「わか蘭」を狙って、黒羽屋蝶兵衛一味がやってきます。 いつも、やまびこ村はてんやわんやの大騒ぎ！ さてさて、今日はどんな花が咲くのでしょうか？ はたして、「わか蘭」は咲くのでしょうか？ そして、はなかっぱは、どんな花を“自分の花”に決めるのでしょう。(C)2010 あきやまただし／はなかっぱプロジェクト,アニメ
ガールズ＆パンツァー,戦車を使った武道「戦車道」が華道や茶道と並んで大和撫子のたしなみとされている世界。県立大洗女子学園に転校生、西住みほがやってきた。戦車道が嫌いで、戦車道のない大洗女子を選んだみほ。ところが転校そうそう生徒会長に呼び出され、必修選択科目で戦車道を選択し、戦車道全国大会に出場するよう強要される。しかも、集まったメンバーは個性派ばかり。華道家元の娘の五十鈴華、恋に恋する武部沙織、戦車マニアの秋山優花里、朝に弱い優等生の冷泉麻子…。友達とのフツーの女子高生活を夢見るみほのささやかな願いは叶うのか…?!(C)GIRLS und PANZER Projekt,アニメ
干物妹！うまるちゃん,容姿端麗、成績優秀、スポーツ万能、誰もが憧れる完璧女子高生の土間うまる。ところが家に帰ると干物な妹“干物妹”(ひもうと)に！？漫画、アニメ、ゲーム、ネット、コーラ、ポテチ……好きなものに囲まれて、過ごす至高のグータラ時間。そんな姿を知っているのは、一緒に暮らすお兄ちゃん・タイヘイだけ。タイヘイに加え、クラスメイトの海老名、きりえ、シルフィンたちと織りなす、うまるの最強で最高な日常(パラダイス)がはじまる…！(C)2015 サンカクヘッド／集英社・「干物妹！うまるちゃん」製作委員会,アニメ
BLACK LAGOON / BLACK LAGOON The Second Barrage,商社マンの岡島緑郎は東南アジアへ出張中に海賊まがいの運び屋「ラグーン商会」に誘拐された。しかし、自分の会社に見捨てられた岡島は“ロック”として「ラグーン商会」の一員となる。13話以降は第2シリーズ「The Second Barrage」。※一部過激な表現が含まれますが、制作されたまま配信致します。(C)広江礼威・小学館／BLACK LAGOON製作委員会,アニメ
ナカノヒトゲノム【実況中】,【最新話は一定期間後に順次プライム会員特典対象（見放題）となる予定です。】『ナカノヒトゲノム』。ゲーム実況者たちの間で話題の、謎のフリーゲーム。通称、失踪ゲーム。クリア直前で姿を消すプレイヤーが後を絶たないという。行方不明となったゲーム実況者たちは、外界とは隔離されたとある島に集められていた。そこで彼らに課されたのは、リアルでクリアしなければならない数々のゲームにおいて、再生数一億を達成すること。８人のカリスマ実況者たちによる、帰還を賭けたリアルゲーム『ナカノヒトゲノム』の実況が始まる-- ©2019 おそら／KADOKAWA／ナカノヒトゲノム【実況中】製作委員会,アニメ
オーバーロードⅡ,時は2138年。一大ブームを巻き起こした仮想現実体感型オンラインゲーム《ユグドラシル》はサービス終了を迎えようとしていた。プレイヤーであるモモンガは仲間と栄華を誇った本拠地ナザリック地下大墳墓で一人静かにその時を待っていた。しかし、終了時間を過ぎてもログアウトされない異常事態が発生。NPCたちが意思を持って動き出し、さらにナザリックの外には見たこともない異世界が広がっていた。モモンガはかつての仲間を探すため、ギルドネームであったアインズ・ウール・ゴウンを名乗り、異世界にその名を轟かすことを決意。絶対の忠誠を誓う配下とともに新たな地へ進軍する。世界を掌中におさめる死の支配者、ここに再臨！！©丸山くがね・KADOKAWA刊／オーバーロード2製作委員会,アニメ
メジャー 第3シリーズ,人気TVアニメの第3シリーズ。海堂高校をやめた吾郎は、野球部のない聖秀高校に編入。吾郎は「打倒、海堂！」実現のため、少ない男子生徒を誘い、新しく野球部を作ろうと奮闘する。ところがクラスメートの藤井、田代たちは、野球なんて興味ナシ！ そこで吾郎が考えた、野球部に入ってもらうための方法とは…。苦労の末、野球部新設は学校に認められ、吾郎と七人の男子全員が形の上では野球部のメンバーに。しかし今度は、野球部の顧問・山田先生がチームに次々と試練を課す。そして吾郎3年生の春、新入生・大河が九人目のメンバーとして野球部に入部。聖秀ナインは、吾郎にとって最後となる夏の大会を目指す！ 果たして吾郎と聖秀ナインは、厳しい神奈川予選を勝ち上がり、かつての仲間・寿也や眉村を擁する史上最強の海堂高校を倒すことができるのか!?(C)満田拓也・小学館／NHK・NEP・ShoPro,アニメ
メジャー 第2シリーズ,原作は週刊少年サンデー上で16年間連載し人気を博した満田拓也によるコミック。ひとりの少年が、プロ野球選手を目指して成長していく様を描いたスポーツ大河ドラマ。第1シリーズでは5歳の主人公が父の遺志を継いでリトルリーグで活躍するまでを描いている。この作品のみどころは、シリーズを重ねるごとに主人公も成長していくところ。まるで、自分の子供の成長を見守るかのような気分にさせてくれる。基本的には原作に沿った展開となっているので、途中から原作コミックを読み始めた人やアニメ版を見始めた人の入門編としてもうってつけだ。また原作で最終回まで知ってしまった人も、第1シリーズから感動のおさらいをしてみるのもよいだろう。(C)満田拓也・小学館／NHK・NEP・ShoPro,アニメ
メジャー 第5シリーズ,人気TVアニメの第5シリーズ。アメリカでのシーズンを終えた吾郎はワールド・カップの開催を知る。日本代表メンバーとしてワールド・カップに参加すべく動き出す吾郎。ライバルたちとの再会、寿也との黄金バッテリーの復活、世界の強豪たちとの闘いを目の前に結束してゆく日本代表。吾郎にとって最大の挑戦が始まる…！(C)満田拓也・小学館／NHK・NEP・ShoPro,アニメ
ゲゲゲの鬼太郎（第4作）,世の中には不可思議な物事がたくさんある。なのに人間たちは、この世のすべてが自分たちだけのものであるかのようにやりたい放題。我が物顔で振るまい、やがて妖怪たちの領域をも脅かすようになった。近ごろ人間たちの上に降りかかる数々の災厄は、怒った妖怪たちの復讐だったのである。しかし鬼太郎は、良い人間だってたくさんいることを信じていた。だからこそ、ねこ娘や砂かけ婆、子なき爺やねずみ男といった仲間たちと共に、人間と妖怪の共存を信じて今日も戦い続けるのである。(C)水木プロ・東映アニメーション,アニメ
しまじろうのわお！,「しまじろう」と愉快な仲間たちが「ちゃれんじ島」で展開する、冒険あり、ファンタジーありの物語。日常生活で起こる様々な出来事、行動を通して、たくさんのことを学んでいきます。©Benesse Corporation,アニメ
PSYCHO-PASS サイコパス （フジテレビオンデマンド）,システムが正義を下し、銃が人を裁く近未来。銃の射手として犯罪者を追う刑事たち。システムを逸脱する犯罪に直面したとき、果たして── 人間の心理状態や性格的傾向を計測し、数値化できるようになった近未来。人々はこの測定値を「PSYCHO-PASS （サイコパス）」の俗称で呼び、その数値を指標として「良き人生」をおくろうと躍起になっていた。 犯罪も数値によって対処される。厚生省公安局の刑事たちは、高い犯罪係数を持ち犯罪者の心理に迫る猟犬「執行官」と冷静な判断力で執行官を指揮するエリート「監視官」がチームを組み、包括的生涯福祉支援システム「シビュラシステム」によって解析された犯罪に関する数値「犯罪係数」をもとに、都市の治安を守る。彼らは、数値が規定値を超えた罪を犯す危険性のある犯罪者「潜在犯」を追い、「犯罪係数」を瞬時に測定し断罪する銃「ドミネーター」で執行するのである。（C）サイコパス製作委員会,アニメ
異世界はスマートフォンとともに。,神様の手違いで死んでしまった主人公は、異世界で第2の人生をスタートさせる。彼にあるのは神様から底上げしてもらった身体と、異世界でも使用可能にしてもらったスマートフォン。様々な人達と出会い、大切な仲間を得ていく中で、いつしか主人公はこの世界の秘密を知る。古代文明の遺産を受け継ぎ、お気楽な世界の王たちと力を合わせながら、個性豊かな女の子たちと共に彼はのほほんと世界を巡っていく−−−（C）冬原パトラ・ホビージャパン／ブリュンヒルド公国,アニメ
やはり俺の青春ラブコメはまちがっている｡続,修学旅行を控えた八幡ら奉仕部に持ち込まれた依頼とは!?新登場の一色いろはも加わり､彼らの関係もさらに複雑さをみせ始める｡八幡の高校生活はどんな展開を迎えるのか?(C)渡 航､小学館/やはりこの製作委員会はまちがっている｡続,アニメ
やはり俺の青春ラブコメはまちがっている｡,”ひねくれぼっち”の高校生･比企谷八幡が｢奉仕部｣に入部し､美少女やギャルと出会い･･･!?残念な主人公が繰り広げる青春ラブコメディ!,アニメ
サザエさん,今まで公式にはどこでも見ることのできなかったサザエさんを是非ご覧ください。 アニメ『サザエさん』の初期放映作品に続き、2005年以降にフジテレビにて放送された作品の一部を配信開始。 いつの時代も明るく楽しいサザエさん一家。お子さんからお年寄りまで、みんなが一緒に楽しめるアニメ『サザエさん』を、お茶の間にお届けします！ ※作品が制作された当時の時代的背景を考慮尊重し、本編は作品完成時の原版の通り配信しております。但し、現存するフィルムの状態や諸事情を鑑み、当時の映像とは異なる部分があることをご了承ください。 （C）長谷川町子所美術館,アニメ
メジャー 第4シリーズ,人気TVアニメの第4シリーズ。いよいよ念願のメジャーリーグ挑戦のため、単身アメリカへと渡った茂野吾郎。空港に着いたとたんにトラブルにあった吾郎を助けたのは、吾郎と同様にメジャーに挑む大学生の八木沼だった。二人はメジャー球団、サーモンズのトライアウト（入団試験）をに挑戦するが…。メジャーへの道に立ちはだかる高く厚い壁と苦闘する吾郎、そして目の前に現れた因縁のライバル。ますますヒートアップする吾郎の闘いの日々!!(C)満田拓也・小学館／NHK・NEP・ShoPro,アニメ
ゴブリンスレイヤー,「俺は世界を救わない。ゴブリンを殺すだけだ」 辺境のギルドには、ゴブリン討伐だけで銀等級（序列三位）にまで上り詰めた稀有な存在がいるという……。 冒険者になって、はじめて組んだパーティがピンチとなった女神官。それを助けた者こそ、ゴブリンスレイヤーと呼ばれる男だった。 彼は手段を選ばず、手間を惜しまずゴブリンだけを退治していく。 そんな彼に振り回される女神官、感謝する受付嬢、彼を待つ幼馴染の牛飼娘。 そんな、彼の噂を聞き、森人（エルフ）の少女が依頼に現れた--。(C)蝸牛くも・SBクリエイティブ／ゴブリンスレイヤー製作委員会,アニメ
地獄先生ぬ～べ～,童守小学校に赴任してきた5年3組担任の鵺野鳴介、通称ぬ～べ～。普段の彼は、ドジでおっちょこちょいなところはあるが、どこか憎めない愛すべき先生として生徒たちに親しまれている。しかしぬ～べ～には、日本でただ一人の霊能力教師という、もう一つの顔があった。常に黒い手袋で覆われている彼の左手には、この世ならざる存在――悪霊や妖怪などに直接触れて、浄化することのできる最強の力「鬼の手」が封印されているのだ。その力は、かつてある生徒を救うため、わが身を賭して封じ込めた地獄の鬼のものだった。子供たちが「闇の住人」に襲われ、危機にさらされた時、ぬ～べ～必殺の「鬼の手」が闇を切り裂き、魔を祓う！はたして今日はどんな怪事件や不思議な出来事が、ぬ～べ～を待ち受けているのだろうか？(C）真倉翔・岡野剛／集英社・東映アニメーション,アニメ
