タイトル,あらすじ,ジャンル
風を待って,雑誌のライフスタイル欄を担当する女性記者が取材でネパールへ。そこで出会った、いけすかない富裕層の若者と、衝突しながらも共に人生の課題に向き合う。,海外/ヒューマンドラマ
めぐり逢いの予感,リッチな男の愛人は彼の子を身籠り、スキャンダルを避けるために中国からシアトルへ。彼女はある運転手に出会い、予想さえしていなかったロマンスが幕を開ける。,ラブコメディ
サミールのテレビ局,ドケチなせいで周囲に嫌われてきた男は、ひょんなことから巨額の金を手にしたことで人生が一変。男はテレビ局を開設し、嫌われ者から一転してセレブに大変身!?,コミカルなコメディ
夢見るタクシー運転手,タクシーの運転手はポップ歌手を夢見ているが、スターへの道のりは競争や苦労ばかり。ある日、彼は親切なベリーダンサーと仲良くなり、運命の歯車が動き始める。,中東映画
ロマンチック・トラブル2: 結婚秒読み,俳優の彼氏ジェムから何としてもプロポーズをゲットしたいディデム。そんな彼の頭を一杯にしている事と言えば、共演する美人女優と、秘密の独身パーティーだけ。,ラブコメディ
結婚相談所,ラマダン初日、イスマイルは友人達と連れ立ってモスクへ。だがそこへ現れた息子が突然結婚を宣言!? この急すぎる結婚話をどうするか、家長の腕の見せ所。,コミカルなコメディ
女性市長ハテ2,自由が制限されていた1949年。後に市長となる主婦は、自分の運命にまだ気づいていない。権力の座を狙う大嘘つき男と、一歩も譲らない全面対決を繰り広げる!,海外映画
女性市長ハテ,子沢山の母親が、ひょんなことから市長になった。満足な教育はもちろん、実務経験もなく、頼りになるのは主婦の知恵のみ。町の運営は、肝っ玉母さんには朝飯前?,コミカルなコメディ
ヘタレ男の逆襲,何もかも上手くいかない男がデートをしていると、相手の女性が突然誘拐されてしまった。自分は不幸な男なんかじゃないと証明するためにも、彼女を助けなければ!,コミカルなコメディ
警官と犬,新たな街へ異動になった警察官は、不慣れな環境に悪戦苦闘の日々。そんな中、彼はある女性に恋をするものの、彼女との共通点がほとんど無くて頭を抱えてしまう。,コミカルなコメディ
キャビン,バカンスを楽しむため、人里離れた森の小屋を訪れる5人の大学生。何も知らない彼らが地下室で禁断の存在を目覚めさせたことで、惨劇の幕が上がる。,ティーン向けホラー
マダガスカル3,アフリカでの冒険を終えたアレックスたちは再びニューヨークを目指すが、あれ? どうやらまた違う所みたい! サーカスの動物たちと知り合った一行は…。,コミカルなコメディ
世界にひとつのプレイブック,精神病院から出てきたばかりで両親と暮らすパットは、浮気した妻の愛情を取り戻そうと必死だった。そんな時、自分に劣らずエキセントリックな女性に出会う。,アカデミー賞受賞映画
モンスター・ホテル,ドラキュラが経営するモンスター・ホテル。娘の118歳の誕生会の前夜、人間の若者がホテルに迷い込んだことから世界中のモンスターを巻き込んだ大騒動が始まる。,キッズ・ファミリー映画
ピッチ・パーフェクト,廃れつつある女子アカペラ部に集まった変わり者のメンバーたち。アカペラ選手権での優勝を目指す中、強烈な個性をぶつけあいながら美しいハーモニーを奏でていく。,海外映画
プロジェクト X,両親不在の日にパーティーを開いて盛り上がろうと考えたモテない男子高校生3人組。だがその噂がネットに流れたことで想像を超える人数が集まってしまい…。,コミカルなコメディ
白雪姫と鏡の女王,誰もが知っているグリム童話を新バージョンで。うら若き白雪姫が、何やらいかがわしい小人たちの力を借り、自分の手で女王の座を奪い返す!,アメリカ映画
"マック&デヴィンの""ハイ""スクール生活",卒業生総代を務めるほど優秀だが世間知らずのデビンと、留年王でドラッグディーラーのマック。まったく正反対の2人が織りなすあぶないハイスクールコメディ。,海外映画
スプリング・ブレイカーズ,春休みのフロリダ。女子大生4人が遊ぶお金を調達しようと強盗を働く。さらに、犯罪行為に手を染めるギャングと出会い、彼女たちの歯車は狂い出す。,ベネチア国際映画祭受賞映画
ムーンライズ・キングダム,ニューイングランドの小さな町。居場所をなくした少年と少女が出逢い、恋に落ちる。駆け落ちして行方をくらませた2人を大人達は必死に捜索するが...。,アメリカ映画
LOL ～ローラの青春～,高校生のローラと友人達が直面する、10代のあれこれ。分かってくれない親、イケナイ火遊び、今しかできない馬鹿騒ぎ。それぞれの苦悩と成長を描く青春物語。,ティーン向け恋愛・ラブストーリー
ハッピーエンドが 書けるまで,ボーゲンズ家の人々が迷いながら愛を模索する姿を描く。父は離婚した母を追いかけストーカー状態。駆け出しの小説家の長女と高校生の長男も恋には不器用だ。,ラブコメディ
ウォールフラワー,初めて知った恋と友情に翻弄される主人公の甘く切ない高校生活を描いた、青春映画の新たなる金字塔。,海外/ヒューマンドラマ
マジック・マイク,ベテランの男性ストリッパー、マジック・マイクが新人ダンサーのキッドにストリップ稼業のオイシイ所と危険な罠を手ほどきする物語。,海外/ヒューマンドラマ
オーマイゴッド 〜神への訴状〜,ムンバイで神像を扱うお店を経営するカーンジーは無神論者。ある日、地震でお店が倒壊するが、天災は保険対象外。怒ったカーンジーは神様を訴えることに...!?,法廷ヒューマンドラマ
アメリカン・パイパイパイ!完結編 俺たちの同騒会,「アメリカン・パイ」で童貞喪失を誓い合った仲間たちが高校卒業10周年の同窓会で大集合。大人になった彼らが、相変わらずおバカな騒動を巻き起こす。,海外映画
恋愛だけじゃダメかしら？,素敵な恋と幸せな結婚。その先にあるのは、親になる喜び? 子供を持つという現実に直面したカップル達の、独特な不安や戸惑いを描くロマンチックコメディ。,ラブコメディ
マダム・イン・ニューヨーク,語学を通して取り戻したのは、ひとりの人間としての自信と輝き。単身訪れたNYで、苦手な英語を克服するため語学学校へ通うインド人主婦の成長を描く物語。,インド映画
俺のムスコ,結婚を間近に控えた息子とフィアンセの家に、自分勝手で図々しい父親が突然転がり込んできた。とにかく一事が万事ハタ迷惑な父親に、息子の怒りが爆発!,海外映画
バチェロレッテ －あの子が結婚するなんて!,仕事も恋も何でも頑張る独身のアラサーが、冴えないと思っていた高校の同窓生が先に結婚すると聞きビックリ。プライドを飲み込み、付き添い人をつとめるが…。,アメリカ映画
私は王である!,国王の三男は博識だが1人では何もできない温室育ち。王位継承者に突然任命されて逃げ出すものの、外の世界には宮殿よりもずっと苦しい試練が待ち受けていた。,アジア映画
システラカス 〜恨み晴らすわよ! 〜,家庭の事情で子供の頃に生き別れになった腹違いのきょうだい。成人した2人がファッション業界で再会、だが1人は子供の頃の恨みを晴らそうと、密かに企んでいた。,アジア映画
ファースト･タイム 素敵な恋の始め方,同じ高校の高嶺の花、ジェーンに憧れるデイブ。だが、ひょんなことから出会ったオーブリーと、笑えるほどぎこちない恋が始まり...。恋愛初心者ラブコメディ。,ラブコメディ
恋の紫煙2,街角の喫煙所で出会い、恋に落ちた愛煙家のカップル。いつしか2人の心はすれ違い、別れが訪れる。それぞれに新たな恋を見つけた2人だが...。,ダークコメディ
あなたを夢みて,古臭い考えの家族が勧める見合い結婚を跳ねのけて、理想の男性を追い求める若き乙女。唯一の武器は、物怖じしない性格と溢れんばかりの熱い恋愛妄想!,ラブコメディ
ジム・ガフィガンのミスター・ユニバース,"ジム・ガフィガンのライブショー。大人にとっての""夢の国""ディズニー・ワールドから、太り過ぎのクジラまで、ありとあらゆる話題に独自の視点をぶちまける。",スタンドアップコメディ
ウマル&サルマ3,音楽への夢を追う夫のウマルと、夫に安定した仕事に就いてほしい妻のサルマ。そんな2人は衝突が絶えず、結婚生活は崩壊の危機に! 大人気シリーズの第3作目。,ラブコメディ
君はだれ?,ジリ貧の私立探偵テキン。なぜか富豪の美女から家出娘の捜索依頼が飛び込むも、早合点な性格が災いし事件はあらぬ方向へ。探偵の本領発揮で事態を収拾せよ!,コミカルなコメディ
ベルリンの虎,ドイツに住むトルコ系ボクサーが連敗でスポンサー相手に背負った借金、5万ユーロ。起死回生には奇跡が必要。だが彼は人生に目的を見つけ、リングに返り咲く。,海外映画
クルトゥルス女性同盟,婚約者と別れて傷心の心理学者が入居したアパートでは、ある女性が何年もDVの被害にあっていた。そこで住人達と一致団結し、サイテーDV男の粛清に乗り出す。,海外映画
夫婦改造計画,リッチでわがまま放題のプレイボーイは、父の会社の経営危機を救うために真面目な女性と結婚する羽目に。彼女も納得していないこの結婚、2人の未来の行方は!?,コミカルなコメディ
めざせ大スター!,ショービズ界のスターになる夢を追いかける男の現実は、無職の売れない歌手。押しの強い母親の叱咤激励(しったげきれい)のもと、夢とロマンスに向かって大奮闘。,コミカルなコメディ
ママに転職!?,広告会社で幹部に昇りつめた女性は、飛行機の中でぐっすり眠って夢の中。目が覚めると...彼女はなんと、3人の子を持つ専業主婦として正反対の人生を送ることに!,コミカルなコメディ
あの娘に首ったけ!,結婚生活に問題を抱える男達が住むアパートに、美しいベリーダンサーが引っ越してきた。男達は何とかして彼女の気を引こうと、あの手この手でアピールし始める。,中東映画
カンフー・パンダ２,恐ろしい武器を操り、中国制圧とカンフーの消滅を狙う新たな敵が登場。マスター・ファイブと共に征伐の旅に出たポーの戦いを描く大迫力のアクション・アニメ。,受賞歴のある映画
ミッドナイト・イン・パリ,真夜中のパリ、0時の鐘は魔法が始まる合図。ハリウッドの脚本家は、芸術の花開く1920年代に迷い込んだ。憧れの巨匠達と交流する中、運命の出会いが訪れる。,アカデミー賞受賞映画
スパイキッズ: ワールドタイム・ミッション,双子のレベッカとセシルの新しいママは元敏腕スパイ。2人は世界を救うため、ママと旧スパイキッズのカルメン&ジュニと共に新スパイキッズとして立ち上がる!,キッズ・ファミリー映画
ハッピー フィート２　踊るペンギンレスキュー隊,タップダンスを踊るペンギン、マンブルがアニメミュージカルの続編に戻ってきた。マンブルの息子エリックは、自分の居場所が見つけられなくて悩むが...。,動物物語
長ぐつをはいたネコ,伝説の金の卵を巡り、お尋ね者のネコが繰り広げる冒険を描く長編アニメ。勇敢でちょっぴりかわいいヒーローをアントニオ・バンデラスが魅力たっぷりに演じる。,コミカルなコメディ
ステイ・フレンズ,仕事を通して出会った、やり手社会人の男女が意気投合して親友に。お互い失恋したばかりの2人は、恋愛感情抜きで体だけの関係を持つことにするが...。,ラブコメディ
イースターラビットのキャンディ工場,ニートの男が車でひいてしまったのは、キャンディの国のウサギの王子。キャンディの国は王子がいなくなって大混乱で、イースターが台無しになっちゃうかも!?,キッズ・ファミリー映画
アーサー・クリスマスの大冒険,極秘の超ハイテク・センターでテクノロジーを駆使して、世界中へプレゼントを届けるサンタクロース。今年は、末っ子のアーサーに、ある大切な任務を任せることに。,コミカルなコメディ
ウソツキは結婚のはじまり,ダニーは既婚者のふりをして一夜限りの関係を楽しむプレイボーイ。ハワイで理想の女性に出会い本気で惚れるが、指輪を見られ、離婚寸前だと嘘をつくことに。,コミカルなコメディ
モンスター上司,惨めな仕事に不満を抱く3人の男たち。仕事をやめるわけにもいかない3人は、細かく干渉してくる上司たちを排除する巧妙な計画を練り上げる。,コミカルなコメディ
スマーフ,悪者の魔法使いガーガメルに追われ、不思議な穴に落ちた妖精スマーフたち。突然現代のニューヨークに放りだされた妖精たちの冒険を描いたファンタジー。,コミカルなコメディ
ホール・パス/帰ってきた夢の独身生活＜1週間限定＞,"突然妻から1週間限定の""浮気許可証""を与えられた2人の既婚男性。久々の独身生活を思いっきり楽しもうと連日夜遊びに繰り出すが…。",ラブコメディ
幸せのジンクス,弁護士として成功をおさめた独身女性が、昔からの友人と一夜を共にしてしまう。でも彼は親友の婚約者でもあり…。大人の三角関係を描いたラブコメディ。,海外/ヒューマンドラマ
未来から来た男,ひょんなことからタイムマシンを発明した天才的科学者。大学時代にタイムスリップして、過去に失った大切な女性を取り戻そうするが...。,中南米映画
あの頃、君を追いかけた,叱られてばかりの問題児と、そのお目付け役に任命されてしまった麗しの優等生。卒業を数か月後に控えた7人の高校生たちの、甘くて酸っぱい青春の日々。,コミカルなコメディ
ジャンピング・ザ・ブルーム ～恋と嵐と結婚式～,上流階級出身のサブリナと、労働者階級の家に育ったジェイソン。社会的にも経済的にも背景が異なる2組の家族が、結婚式のために訪れた島で衝突してしまう!,ラブコメディ
失恋の33日,7年間つきあった彼氏にフラれ、失恋の痛手に苦悩するウェディングプランナー。哀しみのどん底にいる彼女に、意外なところから救いの手が差し伸べられる。,本が原作のヒューマンドラマ
タヌはマヌと結ばれる,ロンドン在住の医者マヌは、気が乗らないながらも両親の勧めでお見合いをしにインドへ帰国する。思いがけず理想の女性と出会うが、彼女には既に恋人がいた。,ラブコメディ
ケヴィン・ハートのラフ・アット・マイ・ペイン,時に鋭いツッコミを交えつつ、絶対すべらない笑いを提供するケヴィン・ハート。劇場全体を爆笑の渦に包み、記録的な成功を収めた2011年ライブツアーを収録。,ダークコメディ
ルーキー・ハウス・ガール,元天才スケボー選手のキムは、家計を支えるためバイトに追われる毎日。そんな中、家政婦の職を得てアルプス山中へ。そこでスノーボードと金持ち男子に出会い...。,ラブコメディ
恋愛被害者の会,ロマンスにあこがれるルームメートの若者3人。ほぼ同時にそれぞれが恋をしたはいいが、男女関係の浮き沈みに振り回され、男たちの日常は混沌と化す。,ラブコメディ
フェイクの親子,偽造屋の男が作る偽造パスポートとビザは精巧で、その腕前はかなりのもの。男は、とある計画に巻き込まれてしまい、大きなトラブルに見舞われる羽目に。,中東映画
恋のラジオ相談室,恋がうまくいかない男女は、それぞれ同僚に背中を押されてデートを重ねていく。ところが、2人とも慣れない駆け引きをしようとするあまり、恋路には暗雲が…。,ラブコメディ
唄えクラリネット! 2,父と再会を果たしたフセインには、やるべき事がもうひとつ。それは世界一素敵な最愛の女性と結ばれる事。型破りな女友達の助けを借りて彼女の心を射止めろ!,コミカルなコメディ
カンフー・パンダ ホリデイ,パンダのポーの楽しみは、毎年冬のウィンターフィーストを父親と過ごすこと。だが”龍の戦士”としての義務と、家族の伝統を守ることの板挟みになり...。,コミカルなコメディ
怪盗グルーの月泥棒,世紀の悪党を目指す怪盗グルーは、月をぬすもうとたくらむ。作戦実現のため、孤児の3姉妹を利用するが、なぜかグルーはなつかれてしまい、共同生活が始まり...。,コミカルなコメディ
メガマインド,宿敵だった正義の味方を倒してしまった悪党メガマインド。新たな宿敵を求め自らヒーローを養成するが、なんとそのヒーローが悪に目覚めてしまい...?!,キッズ・ファミリー映画
シュレック フォーエバー,おとぎ話アニメ映画のパート4。シュレックも中年に差し掛かり心が不安定に!? 家族との平和な暮らしの中、怪物としてのアイデンティティを問い始め…。,アニメーション
タッカーとデイル 史上最悪にツイてないヤツら,山小屋で休暇を過ごしていた田舎者の親友コンビは、キャンプ中の学生達から殺人鬼だと勘違いされる羽目に。誤解が誤解を生み、2人の休暇は血まみれの悪夢と化す!,コミカルなコメディ
小悪魔はなぜモテる?!,"モテないオリーヴはなんとか人気度をあげようと、""Hは経験済み""という嘘をつく。すると明らかに周囲の扱いは変わったが、同時に面倒も巻き起こり…。",青春・学園
なんだかおかしな物語,自殺願望が強くなったことに焦りを感じ、精神科に駆け込んだ16才の少年クレイグ。小児病棟が工事中だったことから、彼は成人患者と同じ病棟に入院することに。,インディーズ系ヒューマンドラマ
お葬式に乾杯!,亡くなった父の葬式を取り仕切ることになった長男のアーロン。葬儀に出席するため兄弟や近親者が続々と集まるが、様々なハプニングが起こり大混乱となっていく。,コミカルなコメディ
ケヴィン・ハートのまじウケる,ヒップホップ調の熱いトークが特徴の黒人コメディアン、ケヴィン・ハートによるスタンダップ。生活の中から浮かぶ面白ネタで満席の会場を笑いの渦に包み込む。,スタンドアップコメディ
幸せの始まりは,プロのソフトボールチームからクビを言い渡されたリサ。恋人のマティは女好きでいい加減。落ち込むリサの前に一見冴えない男性が現れ、微妙な三角関係が始まる。,海外/ヒューマンドラマ
恋の紫煙,禁煙法が施行され、禁煙ムードが高まる香港。街角の喫煙所は、様々なスモーカーたちのたまり場となっていた。そこで1組の男女が出会い、ひかれ合っていく。,ダークコメディ
ハリエットはティーン・スパイ,作家志望のハリエットは、クラスのトップブロガーの座を賭け日々更新に励むもライバルに出遅れてしまう。絶対に勝ちたいハリエットはある秘策を思いつくが…。,児童書が原作の映画
こちらピープリー村,借金に苦しむ2人の貧しい農民は、借金を理由に自殺すると、政府から家族に見舞金が支払われることを知る。話し合いの結果、1人が自殺を決意するが...。,ダークコメディ
サマー・ギフト 〜ほろ苦き夏の歌,蚊との戦い。ビーチでの散々なバカンス計画。薄気味悪いホテルに泊まる家族。季節はそう、夏休み。きらめく太陽の下で展開する、ユーモア満載の短編コメディ集。,ダークコメディ
ロマンチック・トラブル,退屈な人生を送っていたエスラだが、友達の結婚に刺激されて信じがたい行動に出る。仕事も彼も捨て、ロマンチックなトラベル(トラブル?)の始まりに乾杯!,ラブコメディ
ボルボルは途方に暮れる,記憶を無くした男は2人の女性の間で恋心を揺らすものの、彼女達は男をだまそうと画策。そうとは知らない彼は試練を乗り越え、真実の愛をつかむことが出来るのか?,ラブコメディ
4分の3だけ立派な男,新聞で風刺漫画を描く漫画家の使命は、愛する祖国を腐敗させる汚職に立ち向かうこと。何があっても絶対に屈しない、断固とした姿勢を打ち出すのだが…。,政治をテーマにしたヒューマンドラマ
アリの叫び,イラクで無実の罪に問われて服役していた男は釈放され、故郷のエジプトへ。久しぶりに祖国の土を踏んだ男は、革命前夜の様々な現実を目の当たりにしていく。,ダークコメディ
唄えクラリネット!,クラリネットを愛してやまない男は、祖父母と田舎暮らし。ところが大都会へ引っ越す羽目になり、そこで破天荒な歌手に出会う。都会生活は、なんとも刺激的?,コミカルなコメディ
くもりときどきミートボール,"発明家フリント・ロックウッドは、町の人々においしいものを食べてもらおうと、水を食べ物に変える""食べ物マシーン""を開発。しかし、不慮の事故が起こり...。",アニメーション
ジュリー＆ジュリア,アメリカを代表する料理家ジュリア・チャイルドを敬愛する平凡な現代女性ジュリーは、ジュリアの本の全レシピ524品を料理してブログに載せようと決意する。,海外/ヒューマンドラマ
モンスター VS エイリアン,隕石との接触で身長15メートルの巨人になってしまったスーザン・マーフィーは、政府の秘密研究所に収容されることに。そこでスーザンを待っていたものとは…?,受賞歴のある映画
マイレージ、マイライフ,ライアン・ビンガムはプロの解雇宣告人。文字通り全米を飛び回る日々だが、満ち足りていたつもりの生活が、ある新入社員の登場で揺さぶられ始める。,海外/ヒューマンドラマ
男と女の不都合な真実,恋愛に関しては絶対の自信を持つ人気コメンテーターが、理想の男性を射止めたいTVプロデューサーに恋愛指南をするが…。男の本音を描く大人のラブコメディ。,ラブコメディ
理想の彼氏,ニューヨークで暮らすシングルマザーの新しいロマンスの相手は、ひと回り以上も年下の彼氏。周囲の驚きをよそに、2人は年齢差を気にせず愛を深めていくのだが…。,ラブコメディ
セブンティーン・アゲイン,高校生に戻れたら…。何もかもうまくいかない負け組30男マイクの切なる願いが現実に。目覚めると17歳に戻っていたマイクは意気揚々と高校に通い始めるが…。,青春・学園
愛とセックスとセレブリティ,金持ちの年上女の家に転がり込み、パーティー三昧の自由気ままな生活を送っていたプレイボーイのニッキは、ある日、ウェイトレスのヘザーに一目惚れしてしまう。,海外/ヒューマンドラマ
