タイトル,あらすじ,ジャンル
ガールフレンドデー,巨大な陰謀から逃れる唯一の道は、最高のグリーティングカードを作ること。罠に嵌められたライターは、再び人々の心に届く素敵な言葉を紡ぎだすことはできるのか。,ダークコメディ
ノット・アローン,親友は、なぜ自ら命を絶たねばならなかったのか。今でもわからない。18才になった少女は、心の病や自殺願望にさいなまれる若者たちと話す決意をする。,青春・学園
ピックポケッツ: 巧妙なごまかしのゲーム,やる気満々の若き泥棒3人組は、スリの達人から極意や手口を学ぶことに。コロンビアの首都ボゴタを舞台に、3人は腕利きのスリになるべく修行を積む。,中南米映画
ホステージ: ペルー日本大使公邸占拠事件,ペルーの首都、リマで、テロリストにより日本大使公邸が占拠され、祝賀会の招待客であった要人たちも人質に取られた。ショッキングな事件の様子を当事者が語る。,中南米映画
ランニング・ワイルド,農場主の未亡人は、野生馬の群れを世話する一方、囚人の更生プログラムへ農場を提供することに。だが、そんな彼女の奮闘は、過激な活動家の標的になってしまう。,アメリカ映画
マイ・キングダム: 家族が教えてくれたこと,父親の自殺を受け、7人の兄弟姉妹が母親と昔のホームビデオや日記をたどる。愛する人の死について考え、悲しみを乗り越えようとする家族を追ったドキュメンタリー。,海外ドキュメンタリー
アイスランドの迷宮: 未解決事件,アイスランドで2件の殺人事件が発生し、6名が有罪判決を受けた。事件から40年後、新たな事実が発覚する。容疑者達が自白したのは、本当に真実なのだろうか。,実際に起きた犯罪事件を描くドキュメンタリー
マッドマン: スティーブ・マデン・ストーリー,巨額のファッション帝国を築いた靴デザイナーはいかに成功をつかみ、金融スキャンダルによる失脚を乗り越え復活したのか。ドラマのような波乱万丈の人生を追う。,海外ドキュメンタリー
ラエルチのすべて,60歳近くにして、女性への性転換を遂げたブラジルの漫画家ラエルチ・コウチーニョ。その口から語られるのは、年齢を重ねたからこそ分かる、女であることの意味。,海外LGBTQ映画
ミスター・ルーズベルト,売れないコメディアンのエミリー。愛猫危篤の知らせを受け、テキサスの猫の許に駆けつけた彼女は、なぜか元カレとその恋人の所に滞在して過去に向き合うことに。,高い評価を得た映画
不安と共に生きる,"慢性疲労症候群。博士課程の途中でこの病に倒れた女性が、自らの姿にカメラを向け、重篤ながら""怠け""と誤解されがちな疾患の理解を呼びかけるドキュメンタリー。",海外ドキュメンタリー
ホーリー・キャンプ!,エレクトロニック・ミュージック好きな問題児の女子2人。修道女の仕切るキャンプで神に触れ、人生が変わる!? 音楽と元気に満ちたミュージカル・コメディ。,海外/ヒューマンドラマ
母なるもの,威圧的な母親を持つ30代の独身男が、偶然出会ってしまったレズビアンのカップル。どうしても子どもが欲しい彼女たちは男が想像もつかないことを強いるのだった。,海外LGBTQ映画
ミラダ 自由への闘い,共産主義が浸透していた時代のチェコスロバキア。政治家であり人権活動家でもあるミラダ・ホラーコヴァーは困難をものともせず、信念を貫くために戦っていた。,政治をテーマにしたヒューマンドラマ
マイケルに何があったのか?,ベンジー・ナイカムがワイオミング州を訪れる。その目的はゲイの活動家だった元恋人、今は教会で牧師を務めつつ妻と暮らすマイケル・グラッツェに会う事だった。,海外LGBTQ映画
家族のように,どうしても欲しかった赤ん坊を養子に迎えるため、田舎町へと向かう女医。貧しい地区での、法律では認められていない養子縁組。問題に直面した彼女は...。,中南米映画
幸運の銀行強盗,解雇された恨みをはらすため、自堕落な元銀行員と2人のおバカな友人が銀行強盗を働く。だけど、無い知恵を絞って考え出した計画は、完璧にはほど遠く...。,ダークコメディ
アーミステッド・モーピン －小説家の知られざる物語－,「バーバリー・レーン28番地」の著者、アーミステッド・モーピンのドキュメンタリー。保守的な出自から性的マイノリティのヒーローとなるまでの軌跡をたどる。,海外LGBTQ映画
ジャスティン・ファシャヌ: 禁じられたゴール,プロ・サッカー界で初めて、そして唯一、公に同性愛者としてカミングアウトしたジャスティン・ファシャヌ選手。その悲劇に満ちた半生をつづるドキュメンタリー。,スポーツドキュメンタリー
トドリック・ホール: バックステージ・ストーリー,絶大な人気を誇るユーチューバー、トドリック・ホール。保守的なテキサスでゲイとして育ち、エンタメ界で大成功するまでの半自伝的ミュージカルの舞台裏に迫る。,海外LGBTQ映画
ストロング・アイランド,兄を殺した犯人が無罪放免となり、深い悲しみと失望が遺族を襲う。実兄の殺人事件とその根底にある人種差別に迫るヤンス・フォード監督のアカデミー賞候補作。,実際に起きた犯罪事件を描くドキュメンタリー
カノジョと妻とウェディング,マティアスのポケットに入った、ウェディングプランナーの名刺を見つけた彼女。マティアスは行きがかり上、婚約せざるを得なくなり、浮気相手を雇うハメに!,ラブコメディ
マイ・ハッピー・ファミリー,コーカサス地方にある小国ジョージアで教師として働く2児の母マナナが、52歳の誕生日に、三世代同居の家を出て1人で生活すると宣言し、夫や家族を驚かせる。,海外/ヒューマンドラマ
バスク祖国と自由の終焉,"50年以上も活動を続けた、""バスク祖国と自由""ことETA。バスク地方の独立を目指すテログループの終焉を導いた、10年の過程を記録したドキュメンタリー。",スペイン映画
マイ・コンパニオン ～旅は道連れ～,大切な祝日を目前に控え、仕事を失った男は恋人の家族に会うために車で旅をすることに。その途中、彼は愉快な男と出会い、旅は全く予想外の方向へ向かってゆく。,海外映画
マスタング・アイランド,大みそかに恋人に振られたビルは、どうしても彼女のことを諦められない。ビルは彼女を追って季節外れの海辺の町を訪れるが、予期せぬ複雑な事態に陥ってしまう。,インディーズ系ヒューマンドラマ
赤いイスタンブール,長く海外で暮らしていた小説家が映画監督に本を依頼され、イスタンブールに帰って来る。ところが依頼主は消え、いつの間にか奇妙な人間関係に巻き込まれていく。,本が原作のヒューマンドラマ
となりのテロリスト,ワールドカップに沸くスペインの小さな町で、作戦実行命令を待ち続けるテロリスト集団。だがこの男たち、テロリストと呼ぶには少し様子がおかしくて…?,ダークコメディ
ロンボック,麻薬厳禁のドバイで運命の人を見つけたドイツ人のシュテファンは、結婚に必要な書類を用意するために帰郷。だが、悪友のカイと再会し、厄介な事態に陥ってしまう。,海外映画
サン・ドッグス －生きる意味を探して－,"海兵隊入隊という夢に破れた一途な青年と、辛い過去を抱える少女。ふとしたことから出会った2人は、アメリカの平和を脅かす""テロリスト""の確保を目指すが…。",インディーズ系ヒューマンドラマ
恋するスピヴァク,売れない作家、ウォリー・スピヴァクの人生は、何もかもがマンネリ状態。ある日、自由奔放で魅力的なカップルとの出会いをきっかけに視界が開け、生まれ変わる。,アメリカ映画
黒い雪,人目を避けてパタゴニアの辺境の地に住むサルバドル。その土地の相続をめぐり、長年疎遠になっていた兄弟が再会し、過去に起こった家族の悲劇と憎しみが蘇る。,心理サスペンス
刑事ハンサム: Netflixオリジナルミステリー,殺人事件を捜査する刑事、ジーン・ハンサムにとって、事件解決のカギを見つけるよりも、自分の孤独な私生活に足りないものを見つける方がずっと難しい…。,ダークコメディ
ラングーン,時は第二次世界大戦中。恐れを知らない人気女優のミス・ジュリアは、戦士達の慰問にビルマ国境の前線へ。そこで彼女を待っていたのは、愛と裏切りの罠だった。,軍隊・戦争系アクション
キレるオヤジの逆襲,アルゼンチンに住むスペイン人男性。仕事も私生活も絶好調な中、通りすがりの男に道を聞かれる。間違った方向を指さしたことで恨みを買い、人生が暗転し始める。,スペイン映画
マイケル・ボルトンのビッグでセクシーなバレンタインスペシャル,サンタが用意した大量のプレゼントを配るのに必要な子供の数、7万5千人。そこでマイケル・ボルトンが一肌脱いで、皆が子作りに励むよう特別番組を開始!,ラブコメディ
Lovesick,インドの医師は偏見と闘って病院を設立し、HIVやAIDS患者の寿命を延ばそうと尽力してきた。彼女の新たな使命、それは患者達に結婚相手を見つけてあげること。,海外ドキュメンタリー
家族のあいだで,結婚生活に問題を抱える男は、ひょんなことから女性歌手と友達に。彼女の娘がプロポーズされると、男は娘の父親役を務めてほしいと頼まれ、大騒動が幕を開ける。,海外映画
狩りの季節,怒りを持て余す10代の青年が疎遠になっていた血縁の父のもとに身を寄せる。壮大なパタゴニアの大自然の中では憎しみも徐々に愛と許しの気持ちに変わっていく。,中南米映画
ウェディング・パーティー,愛し合うカップルにとって結婚式は人生最大のイベント! だが入念に計画した盛大な披露宴が元恋人、家族、招かれざる客にも引っかき回されて、さあ大変。,ラブコメディ
コイン強盗クラブ,財政危機に見舞われた学校を救おうと、1000万ドル獲得計画を企む4人の高校生たち。その大胆な作戦とは、天下のアメリカ造幣局へ忍び込むこと!,海外/ヒューマンドラマ
ロング・タイム・ランニング,多くの人に愛されたロックバンド、ザ・トラジカリー・ヒップ。2016年に母国カナダで敢行された、バンド最後のツアーに迫るドキュメンタリー。,海外ドキュメンタリー
イヴのりんご,アフリカを中心に今なお残る、女性器切除の風習。国際的な枠組みを作ろうとする人々やアフリカ各国の少女達から話を聞き、その実態と廃絶に向けた努力に迫る。,スペイン映画
ミス・ミー・ディス・クリスマス,夫婦は別れることになり、離婚が成立するのはクリスマスの日。本当に全てを終わらせてもいいのか、2人は自らの胸に問いかける。聖なる夜に愛の奇跡は起こるのか?,海外ラブロマンス
ほろ苦い思い出,配達員として働く孤独な男性・シャオマが住む街で撲殺事件が発生。ある日、彼は病院で見かけた美しい女医を生き別れた姉と思い込み、彼女に執着するようになる。,犯罪アクション・アドベンチャー
ネクスト・コメディ,新しい笑いを追求し、映画の歴史を変えるような作品を作りたかったコメディアンと監督。だが、やがてネタは尽き、結末も曖昧なまま、映画作りは迷走を始める。,スペイン映画
レッドツリー: ホロコースト生存者の記憶,第二次世界大戦中、ナチス占領下のプラハからブラジルへと逃れたユダヤ人家族。その後、建築家として人生を送った父を持つ女性が、壮絶な家族の歴史を語る。,イギリス映画
イーグルス・オブ・デス・メタル: パリの友に捧ぐ,ライブ中のテロ襲撃事件から3ヵ月。イーグルス・オブ・デス・メタルがパリのステージに復帰した。テロの恐怖と彼らの復活までの道程を追ったドキュメンタリー。,海外ドキュメンタリー
キリング・ファミリー 殺し合う一家,無残に殺された母と弟の遺骨を引き取るため、遠く離れた街へとやって来た息子。そこで待ち受けていたのは、保険金詐欺を企む男と、知ってはいけない危険な秘密。,中南米映画
ディードラ&レイニーの列車強盗,母子家庭の母親が刑務所に入り、お金が底をつく。困り果てた姉妹は、貨物列車を襲う計画を立てた。10代の子どもだけで生きていくには、これしかない!?,インディーズ系ヒューマンドラマ
ひとときの栄光,世間のことに無関心で孤独なスペインの軍人、ルイス。ある日カルランという女性に出会い、激しい恋慕の情を抱くが、彼女の目的は権力を手にすることだけだった。,本が原作のヒューマンドラマ
ポッターズビルの奇跡,やけ酒で酔っ払った男がゴリラの着ぐるみを着て街をうろつく。ビッグフット出没のうわさがちょっとしたブームを巻き起こし、寂れた町はにわかに活気づくが...。,海外映画
ブロックバスター,病床に伏せる父のための動画がきっかけで彼女に振られてしまったジェレミー。その心を取り戻すべく、奇想天外な計画を思いつくが…。合言葉はスーパーヒーロー!,ラブロマンス
俺は伝説の戦士(の孫!?),青年は自分が有名な戦士の孫だったことを知り、敵対する組織に立ち向かって村一番の美女の心をつかもうと決意。彼女に勇姿を見せるため、大騒動が幕を開ける。,中東映画
ミス・クリスマス,利益優先主義の男は、家族が経営するホテルをリニューアルしようと画策。そんな彼の前に、クリスマスをこよなく愛する陽気なホテルの装飾係が立ちはだかる。,ラブコメディ
ファミリー: 兄弟の歩む道,5年の刑期を終えてシャバに戻った男の双肩に、弟2人の人生がのしかかる。1人はギャンブラー、もう1人はダウン症を持つ青年。タフでなければ家族は守れない。,インディーズ系ヒューマンドラマ
スピーチ&ディベート,クリエイティブ精神にあふれる、はみ出し者の高校生達。大人の偽善にウンザリした3人が、弁論討論部を復活させて自分らの意見を表現する場を勝ち取ろうとする。,インディーズ系ヒューマンドラマ
疑り深い男,何もかもが不安で、他人のことを全く信じられない男。やっかいな性分のせいで、脳天気な妻や息子ともトラブル続き。面倒くさいこの性格、直せるものなら直したい!,中東映画
結婚狂騒曲,歌手の仕事がほとんどなくなった2人の男たちが、富豪の娘をつかまえて結婚しようと企む。カネさえあれば幸せな人生を送れると思っていたが、甘かった。,中東映画
ハムザのスーツケース,記憶をなくしたプロの詐欺師。犯罪組織のメンバーたちと共に、消えた大金入りのスーツケースを取り戻そうとする中で、次第に明らかになる事実とは...。,コミカルなコメディ
願い事の樹,願い事をした不思議な木が切られてしまう! 森のはずれに住む5人の子供たちは、大切な木を守るために協力。やがて、本当の幸せへの道しるべを見つけてゆく。,インド映画
スノーデン,アメリカ政府による恐るべき情報収集を告発したエドワード・スノーデン。軍への志願入隊からCIAの活動に不信を募らせて命がけの告発を行うまでを描く実話物語。,政治をテーマにしたヒューマンドラマ
SING/シング,つぶれかけた劇場を復活させるため、支配人のコアラは歌のオーディションを開催。集まったのは内気なゾウ、ゴリラの少年、ブタの主婦など。新たなスター誕生!?,音楽・ミュージカル
スペクトル,異次元の敵が襲来し、戦火に包まれたヨーロッパの街は壊滅状態。この危機に立ち向かうのは、ある技師と精鋭揃いの特殊作戦部隊。未知なる脅威との死闘が始まる。,SFアクション
メッセージ,世界各地に巨大UFOが出現。謎の生命体との会話という任務を託された言語学者は、未知の言語を探る中、人類そして彼女自身に向けられたメッセージを解明する。,SFヒューマンドラマ
新感染 ファイナル・エクスプレス,全国に広がる恐ろしいウイルス感染。密室と化した車内で増幅するパニック。プサンを目指す父娘を乗せた高速鉄道は、かつてない恐怖へとノンストップで走り続ける!,受賞歴のある映画
カンフー・パンダ3,秘密のパンダ村を訪れたポーとその父親。ポーはできそこないのパンダたちを寄せ集めて軍団を組み、中国全土を脅かす悪党に立ち向かう。,アニメーション
スプリット,3人の女子高生が、23の人格を持つ男に誘拐され監禁される。はたして彼女たちは、男の24番目かつ最も危険な人格が現れる前に逃げ切ることができるのか。,心理サスペンス
ミニマリズム: 本当に大切なもの,物質的な豊かさが幸せをもたらすというアメリカ的考え方を拒否し、シンプルな暮らしを実践するミニマリスト。真に大切なものとは何かを問うドキュメンタリー。,自然・生態系ドキュメンタリー
LO: インターネットの始まり,世界をつなぎ、今や不可欠となったインターネット。映画監督、ヴェルナー・ヘルツォークが、その誕生と歴史を辿り、インターネットが生み出した光と影に迫る。,科学・技術ドキュメンタリー
キング・オブ・エジプト,古代エジプト。弟である砂漠の神セトに王座を奪われた天空の神ホルス。セトの圧政に苦しむ人々を救うため、ホルスは盗賊の青年と手を組み、壮絶なバトルに挑む。,ファンタジー
アサシン クリード,大人気のビデオゲームの映画化。殺人犯の死刑執行。だが死んだはずの男は謎の組織に囚われ目を覚ます。そして遺伝子を操作する装置により祖先の記憶を追体験する。,大ヒットSF・ファンタジー
シリコン・カウボーイズ,1982年に3人の友人達が設立したPC企業、コンパック。市場の頂点に君臨していた巨大企業、IBMに真っ向から挑戦状を叩きつけた、開拓者達の歩みを追う。,科学・技術ドキュメンタリー
カンフー・パンダ 秘密の巻物,"運命のいたずらによって5匹の動物がチームを組むことに。それぞれ独自のカンフースタイルを活かすことで、無敵のグループ""マスター・ファイブ""が誕生する!",コミカルなコメディ
グレートウォール,よう兵部隊は強力な火薬を求めて旅を続け、万里の長城にたどり着く。そこで彼らが目にしたのは、凶暴な怪物と誇り高き勇猛な戦士達との空前絶後の大戦争だった。,大ヒットSF・ファンタジー
スイス・アーミー・マン,無人島で助けを待つ若者は絶望の末に自殺を決意。だがその時、男の死体が流れ着く。その死体はスイス・アーミー・ナイフのごとく便利な多機能を発揮し始める。,インディーズ系ヒューマンドラマ
KUBO/クボ 二本の弦の秘密,不思議な力を持つ片目の少年は、魔法の武具を探す旅に出る。行く手には、闇の魔力を持つ祖父、月の帝の刺客が立ちはだかる。旅の果てに待つ、隠された真実とは?,受賞歴のある映画
メカニック: ワールドミッション,元殺し屋の男は大切な女を人質に取られ、因縁の相手からの暗殺依頼を受けることに。ターゲットは、世界を裏で操る大物達。この危険すぎるミッションの行方は?,犯罪アクション・アドベンチャー
ラ・ラ・ランド,大都会ロサンゼルス。夢をかなえようと奮闘する男女が出会い、急速に互いの距離を縮めていく。恋愛成就か、夢の大成か、切ない運命が2人を待っていた。,アカデミー賞受賞映画
トロールズ,トロール達が、恐ろしいベルゲンにさらわれた! ベルゲンに食べられる前に、大切な仲間達を助けなきゃ。元気なポピー姫と気難しいブランチが、救出作戦を開始!,音楽・ミュージカル
ムーンライト,マイアミの犯罪地区。内気な黒人少年は学校ではオカマと苛められ、母親は麻薬中毒で育児放棄。そんな彼の心の支えは、たった1人の友と近所の麻薬ディーラー。,海外LGBTQ映画
LEGO(R)ジュラシック・ワールド: インドミナス大脱走!,"""ジュラシック・ワールド""で遺伝子操作により誕生した新種の恐竜インドミナス・レックスが、好物のホットドッグを食べ尽くし暴れ始めた。何とか暴走を止めないと!",キッズ・ファミリー映画
グランド・イリュージョン 見破られたトリック,正義の犯罪集団、フォー・ホースメン。新たなメンバーを加え、巨大IT企業の個人情報売買を暴露すべく動き出すが、天才エンジニアに阻止されてしまう。,強盗アクション
ロッコ: ポルノスター引退宣言,イタリアのポルノスター、ロッコ・シフレディが引退した最後の年を追ったドキュメンタリー。ポルノ界の伝説的スターがカメラの前で見せてくれるものとは。,海外ドキュメンタリー
イントゥ・ザ・インフェルノ: マグマの世界,世界各地の大噴火や煌々と流れる溶岩の迫力の映像とともに、火山を畏れ敬う人々の儀式を取材し、火山と人間の関係を考えるヴェルナー・ヘルツォーク監督作品。,科学・技術ドキュメンタリー
ハイパーカー: 頂点に立つ車,ある男が理想を胸に、燃費の良い高パフォーマンスにこだわったハイパーカーを誕生させた。市場で待ちうけるのは、フェラーリ、ポルシェといった強豪メーカーだ。,アメリカ映画
マッドタウン,クスリ漬けの者が集う砂漠の共同体と人食い部族の集落。荒地に放置され、手足を失った女にとって、どちらを選んでも、悪夢が待っていることには変わりない...。,ベネチア国際映画祭受賞映画
女神の見えざる手,銃擁護派団体からの依頼を断った腕利きの女ロビイスト。巨大権力を敵に回した彼女は、銃規制法案の成立に向け、奇策を仕掛けて精力的に動き出すが...。,高い評価を得た映画
エンド･オブ･キングダム,各国首脳が集まるロンドンで、報復に燃えるテロリストが起こした同時多発テロ。警護のプロ、マイク・バニングが再びアメリカ大統領を、そして世界の未来を守る。,欧米大ヒット映画
アンソニー・ロビンズ －あなたが運命を変える－,ダイナミックで型破りなスタイルの自己啓発セミナーで世界中に知られるアンソニー・ロビンズ。毎年恒例の超大規模イベントの内幕を伝えるドキュメンタリー。,海外ドキュメンタリー
サイレンス,人里離れた森の中に移り住んだ耳の聞こえないライター。ある日、覆面をした殺人鬼が窓の外に現れ、命をかけて立ち向かうことに...。,高い評価を得た映画
