タイトル,あらすじ,ジャンル
ストリート,マフィアのリーダーにファイターとしてスカウトされた総合格闘技のアマチュア選手。マフィアに逆らい、辛く厳しい試練を乗り越えて名を馳せようとする。,アメリカ映画
ホールディング・ザ・マン －君を胸に抱いて－,70年代のオーストラリア。男子校で出会った2人は恋に落ち、どんな壁も2人で乗り越え笑い飛ばしてきた。15年の歳月が流れ、今までにない試練が2人を襲う。,海外LGBTQ映画
ビル・マーレイ・クリスマス,不運に見舞われながら、ホテルに居合わせた人々とともに歌や踊りで過ごす最高の聖夜 -- ビル・マーレイが豪華スターらと贈るクリスマスバラエティショー。,海外映画
ジェレミー・スコット: 人を仕立てるデザイナー,"ミズーリ州の貧しい農家で育ち、""モスキーノ""のクリエーティブ・ディレクターに上り詰めた人気デザイナー、ジェレミー・スコットの足跡を追うドキュメンタリー。",海外ドキュメンタリー
チャック・ノリス vs. 共産主義,チャウシェスク独裁政権下、西側メディアが禁じられたルーマニア。自由世界を見せてくれたのは、密かに吹き替え付きで出回っていた外国映画のVHSテープだった。,海外ドキュメンタリー
トム・ソーヤーの盗賊団,もしトム・ソーヤーとハックルベリー・フィンが現代に生きていたら…。やんちゃな2人が、少年時代から捜す宝物を手に入れようと、はみ出し者たちと手を組んだ。,アドベンチャー
エビータは眠らない,暗い隠密な出来事の下、国から国へと運ばれる女性の遺体。さまざまな議論を呼んだ人物、エバ・ペロンの物語は、その死後も続いていたのだった。,中南米映画
勇者は再び巡り会う,若い男女が恋に落ちるも、数奇な運命に仲を引き割かれてしまう。何年もの月日が経ち、2人は思いがけないきっかけから、赤い糸に導かれるように再び巡り会う。,海外ラブロマンス
アンディはここにいる,TVドラマ「スパルタカス」の主演俳優アンディ・ホイットフィールドに突きつけられた癌宣告。絶望と不安の中、一日一日を真摯に生きた男の闘いの軌跡をここに。,海外ドキュメンタリー
疾風スプリンター,自転車ロードレースチームに所属し、頂点を目指す3人の男達。互いに競い合い、高め合う3人は、やがて自身の情熱とチームへの思いとの間で板挟みになってゆく。,海外/ヒューマンドラマ
ブルゴーニュで会いましょう,著名なワイン評論家となった男が、ブルゴーニュの実家に戻る。倒産の危機にある実家のワイナリーを再建しようとするも、疎遠にしていた溝はなかなか埋まらず...。,海外ラブロマンス
ラ(ブ),敏腕金融マンは、親友とハイキングの旅へ行くことに。それは、恋人と上手くいっていない友への本当の想いを知る旅となる。2人の間に大きな変化が生まれてゆく。,海外LGBTQ映画
ロデオ&ジュリエット,亡き祖父の田舎の牧場を渋々訪れた若い都会っ子。環境の変化に戸惑う彼女を救ってくれたのは、馬にまたがる王子様ならぬ、ハンサムなカウボーイだった。,海外/ヒューマンドラマ
双子物語,フランス人の女子学生がインターネットを通じて見つけたのは、存在すら知らなかった自分の双子の姉妹だった…。奇跡の実話に基づいたドキュメンタリー。,海外ドキュメンタリー
ソウルへGO!!,1986年、海外で生まれ育った韓国系の少年少女達は、ソウルへやって来た。サマーキャンプで自分達のルーツに触れる彼らの、熱くてまぶしい青春の一夏が始まる。,ラブコメディ
ブラインド・デート,音楽に情熱を注ぐピアニストと、沈黙をこよなく愛するパズル製作者が、薄い壁を隔てた隣の部屋に住むことに。違いすぎる相手の生活パターンに苛立つ2人だが…。,ラブコメディ
好きにならずにいられない,しがない独身デブ男が誕生日にもらったレッスン券で訪れたダンス教室。待っていたのは不器用なまでの恋心。それは自身を見つめなおす、人生の贈り物でもあった。,海外ラブロマンス
手遅れの過去,退廃的なレトロ感漂う南カリフォルニアを舞台に、酒に溺れた私立探偵が過去に見知った女の消息を辿る。先行きが見えず、虚無的な空気を纏った捜査の顛末とは。,インディーズ系ヒューマンドラマ
ビジョン,インドのある町で警察署の長官の息子が失踪。ケーブルテレビ会社を営む町の名士に殺人容疑がかけられる。しかし、彼には完璧なアリバイがあった。,ミステリー
わたしはマララ,女子の教育権を訴えたことで銃撃され、瀕死の重傷を負ったパキスタンの少女。奇跡的に回復し、今なお活動を続ける彼女の半生を描いた真実のドキュメンタリー。,海外ドキュメンタリー
クーパー家の晩餐会,"クーパー家恒例のクリスマスの晩餐会。密かに離婚を決めたクーパー夫妻だが、妻は""最後に完璧なクリスマスを""と奮闘。だが家族が隠し持つ秘密が露見していく。",ラブコメディ
出村文男 - ハリウッドの武道家,空手の達人、出村文男。映画「ベスト・キッド」でのミスター・ミヤギのスタントで知られる彼を慕う者は多い。その足跡やハリウッドへの影響が、ここに描かれる。,スポーツドキュメンタリー
有罪,10代の少女が死体で見つかり、次にその家の使用人の死体が見つかった。事件を追う警察は見当違いの捜査や尋問の末、ある人物を第一容疑者とするのだが…。,海外/ヒューマンドラマ
アイ・アム・ソンム,現在ソウルを拠点にアーティストとして活躍する元北朝鮮宣伝物作家のソンム。金正日・独裁体制の風刺アートを制作しつつ、脱北者としての葛藤に悩む素顔に迫る。,アジア映画
アーメダバードへようこそ!,彼はどこにでもいる11才の少年。インド最大の凧揚げ祭りで色鮮やかに染まる万華鏡の空の下...腕を競い合い、夢中で凧を追いかける少年の日々を追う。,海外ドキュメンタリー
エヴォリューション,少年と女性しかいない静かな町。海で泳いでいる際に死体を見つけた少年は次第に、不思議な出来事や奇妙な医療行為がある、この島の暮らしに違和感を抱き始める。,超常現象ホラー
ハリーとスノーマン,第二次世界大戦中、ユダヤ人救出の地下活動に携わったハリー。戦後アメリカに移民し、1頭の耕馬と出会い、障害飛越のチャンピオンに育てた数奇な運命を描く感動作。,スポーツドキュメンタリー
未来を花束にして,20世紀初頭、英国。すべてを犠牲にしながらも、参政権運動に身を投じてゆく若い母親。苛烈な弾圧に抵抗すべく、仲間たちと共に過激な手段に打って出ることに。,政治をテーマにしたヒューマンドラマ
今日の恋愛,人気お天気キャスター・ヒョヌ。不倫というフクザツな恋愛に身を置く彼女のグチを聞き、どんな時でも支えてくれるのは、18年来の男友達であるジュンスだった。,ラブコメディ
毎日あなたを愛してる,こん睡状態にある恋人が目覚めるのを待ち望む献身的なオードリー。ある日、野心家のTVプロデューサー、イーサンに出会い、2人は互いにひかれ始める。,アジア映画
恋愛被害者の会2,親友の若者3人が同じタイミングで一目惚れ!? しかし、夢見ていた真のロマンスと現実は大違い。それぞれ恋愛のすったもんだに振り回され、頭を悩ます。,ラブコメディ
ナオミとイーライのキス禁止リスト,ナオミとイーライは小さな頃からの大親友。でも、ゲイのイーライがナオミのボーイフレンドとキスしてしまったことから、2人の友情に亀裂が入ってしまう。,海外LGBTQ映画
アブスルダ －愚かな恋－,ネットで出会った年上の男性に夢中になる16才。だが彼にとってはただの火遊びだった…。彼のことが忘れられない少女は拒食症になり、心の均衡を失っていく。,中南米映画
ジャネット 呪われたマオリ,家族による悪魔祓いの途中に命を落としたマオリ族のジャネット・モーゼス。関係者のインタビューを通して、世界的な物議を醸した悲劇の真相を探る。,海外ドキュメンタリー
テラー / (T)ERROR,米FBIのテロ対策おとり捜査で、政府の情報提供者とターゲットである過激派グループ、両サイドの視点から真実を見つめて物議を醸したドキュメンタリー。,海外ドキュメンタリー
ジャック・キング作戦,"第二次世界大戦中に、英国情報局保安部(MI5)が遂行した極秘作戦。軍事機密を守るため、""見えない敵""に立ち向かったスパイの知られざる物語がいま明かされる。",海外ドキュメンタリー
灼熱,1991年から2001年にかけて続いた、クロアチア人とセルビア人の紛争。民族同士が憎しみ傷つけあう悲劇に翻弄された3組の男女の愛が、3つの時代を舞台に描かれる。,海外ラブロマンス
ミス・シャロン・ジョーンズ!,ソウル&ファンクの歌手シャロン・ジョーンズを追ったドキュメンタリー。癌の発覚、闘病、そして復活コンサート。逆境に負けない迫力のボーカルを、堪能せよ。,海外ドキュメンタリー
タイラー・オークリー 君は君のままで,YouTube界で大人気のゲイコミュニティの擁護者タイラー・オークリー。人生観や恋愛観など彼のパーソナルな一面に迫るドキュメンタリー。,海外LGBTQ映画
スリーブラザーズ&ベビー,家族でビジネスを営む3兄弟の冴えない日々に、大事件発生。なんと、赤ん坊の世話をすることに。三人寄れば文殊の知恵も三矢の教えも、この3人には関係無し。,コミカルなコメディ
スモッシュ,好きな人には見せられない恥ずかしい動画がネット上に流出! 大ピンチのアンソニーは、親友とともにバーチャルの世界へ侵入し動画を変えようとするが...?!,コミカルなコメディ
夜の珍客,とある名家の屋敷では、娘の盛大な婚約パーティーが始まろうとしていた。そこへ、ある若い女性の自殺について調べているという1人の探偵が現れ...。,ミステリー
クリスマス・キス,有名な振付師と婚約中のケイラは、2人の将来に不安を感じていた。そんなある日、成り行きで見知らぬ男性とキスしてしまい、彼女の心はますます揺れる。,アメリカ映画
人生タクシー,テヘランの街並みを走り抜けるタクシー。運転手はジャファル・パナヒ監督自身。ダッシュボードに設置したカメラが、乗客達が語る悲喜こもごもの人生をとらえる。,中東映画
ワンナイト･カップル,この関係の期限は、コーヒークーポン券のスタンプが10回貯まるまで。恋に破れ、勢いで体を重ねた2人の不思議な交際スタート。,ラブコメディ
ガン・ランナーズ,牛泥棒と殺し合いが蔓延するケニア。武器と引き換えに、マラソンを通してやり直すチャンスを手にした2人の元盗賊が、希望と試練に向き合っていく姿を追う。,スポーツドキュメンタリー
飴色のラプソディ,オーストラリアの弦楽四重奏団ASQと、そのメンバー全員が使用する世界的名器ガダニーニにスポットをあて、クラシック音楽業界の舞台裏に迫るドキュメンタリー。,海外ドキュメンタリー
親友のカミングアウト,自動車修理工場で働く若者が、親友たちにゲイであることをカミングアウト。親友たちは戸惑いながらも、仲間である彼に最高の恋人を見つけるために奮闘する。,海外LGBTQ映画
レインボー,少女は、盲目の弟の手を取って旅に出た。憧れの映画スターなら、きっと弟に目の手術を受けさせてくれるはず。純粋な願いを抱いて、小さな2人の大きな旅は続く。,高い評価を得た映画
クリスマス・スピリット,クリスマスの足音が聞こえる頃。弁護士のケイト・ジョーダンは売却予定の宿を査定するためバーモント州へ向かう。その建物にはハンサムな幽霊がとりついていた。,海外ラブロマンス
運命というもの,恋に破れ失意のどん底に突き落とされたヒロイン。見かねて手を差し伸べた通りすがりの親切な青年。偶然の出会いから、2人の新たな一歩が始まる。,アジア映画
ゲームの時間,深夜の密会場所を求め、2組のカップルは閉店後のショッピングモールに侵入。そこで待ち受けていたのは、凄惨極まる死のゲーム。悲鳴は、夜を切り裂き響き渡る。,ファンタジー
忘れられない記憶,1990年、DJを夢見るドイツ人青年がイビサ島へ移り、何十年も前にその土地へ移住した隣人と親しくなる。だが彼女には、謎めいた過去があるようで...。,インディーズ系ヒューマンドラマ
悪魔の協定,魔法とテクノロジーが共存し、交錯する世界。葉巻の煙をくゆらす怪しい魔術師の男は、いつしか地獄との総力戦に巻き込まれていく。,中南米映画
フレンチの王様 ジョージ・ペリエ,ジョージ・ペリエはフィラデルフィアにおけるフランス料理の草分けだ。だが時代が変われば客も味も変わる。店を守ろうと働き続ける男の背中をカメラが追う。,海外ドキュメンタリー
戦時下 女性たちは動いた (1939-1945),第二次世界大戦で戦ったのは、戦地に向かう男たちだけではない。母、妻、そして看護師や兵士、追放を受けた女たちもまた、自由と生き残りを賭け迫害と戦っていた。,海外ドキュメンタリー
尋問,インド南東部の警察では、4人のタミル人労働者を犯罪者に仕立て上げるための拷問が続いていた…。実際の事件を基に、政府や警察の腐敗を浮き彫りにした衝撃の物語。,本が原作のヒューマンドラマ
レンズの向こう側,Webカメラとのぞきにはまった既婚男性が、ある日、ネットで見知らぬ人と出会う。軽い気持ちでチャットを始めるが、自殺のライブ映像を見て欲しいと頼まれる。,マインドゲームスリラー
エル・クラン,近所からも慕われている、裕福なプッチオ家。ところが、その裏には驚きの秘密が。一家は金持ちを狙った誘拐を繰り返し、その身代金で財を成していたのだった。,ベネチア国際映画祭受賞映画
夢と希望のベルリン生活,大学卒業後も就職が決まらない2人の青年が、あるTVコマーシャルを見てベルリンで働くことを決意する。だが、宣伝とは大違い。ドイツの生活も楽じゃない!,スペイン映画
セネガルの春,セネガルの名も無き若者達は、権力の座に固執する大統領に異を唱え、民主主義の名のもとに立ち上がった。2012年の大統領選挙の激動が、ここに克明に記される。,海外ドキュメンタリー
邪悪なヒーロー,"セックス・暴力・窃盗の日々を過ごす3人の若者。深い考えもなく、気に入らない相手をヒーロー気取りで""成敗""していくうち、取り返しのつかない事態を招く。",スペイン映画
ルースのワンダフル・クリスマス,犬好きのイケメンと友達になった21歳のルースは、世話になっている隣人が計画している犬の公園の取り壊しに彼が反対していると知り、板挟みで悩むことに。,ラブコメディ
おじいちゃんのラジオ,老齢で耳の聞こえにくいインド人の男が幼い頃から大切に持っていたラジオ。そこから過去の世界へ引き込まれていく。別世界で彼の耳に聞こえてくるものとは。,ヒューマンドラマ
怒れる女神たち,女性フォトグラファーは、親友の女子達を家に招待。ガールズトークに花が咲く中、サプライズで婚約を発表。すると、様々な感情の波が彼女達の心に生まれてゆく。,海外LGBTQ映画
当然の選択,転校先で同級生と打ち解けられない内気な高校生。そんな彼に、ある日声をかけてくれた少年。2人は仲良くなるが、次第に彼の裏の顔が明らかになっていく。,青春・学園
ミニバスに乗ったお姫様,ミニバスの運転手ルザは、不器用だがみんなに愛される下町の人気者。そんな彼がひょんなことから絶世の美女を連れて帰ってきたことで、小さな町は大騒ぎに!,ファンタジー
白い肌の黒人 －アフリカのアルビノ迫害－,アフリカに住むアルビノが直面する健康上の問題や迷信による迫害、さらには差別など社会的苦難の現実と、彼らを支援するスペインの擁護団体の活動に迫る。,スペイン映画
50,ナイジェリアの大都市ラゴスで裕福な暮らしを送る4人の女性たち。50歳の節目を目前に、これまでの人生と恋愛を振り返るそれぞれの1週間を描き出す。,海外/ヒューマンドラマ
リッチモンドのロミオ,「ロミオとジュリエット」になぞらえて、カリフォルニア州リッチモンドで頻発するギャング抗争の現状を訴える詩人ドンテ・クラークの姿を追うドキュメンタリー。,海外ドキュメンタリー
空飛ぶサルのオジー,オズの国の空飛ぶサルたちは怖くて意地悪。でも、賢いオジーと仲間たちは、オズに平和を取り戻そうと、邪悪な策略をたくらむ西の悪い魔女に立ち向かう。,児童書が原作の映画
ビタルとアリックス,繊維工場で働く既婚の男と、その上司の娘。共に過ごす時間を重ねる2人は、やがて激しい恋に落ちてゆく。だが、2人の愛は、職場に不協和音をもたらしてしまう。,海外ラブロマンス
雄鶏の血,虫の息で目を開けると、青年は見知らぬ場所に倒れていた。あれは卒業式帰りの車中だった。フラッシュバックする過去。真実を知った彼の身に何が起こったのか。,中南米映画
ヘビー級の心,取り立て屋で食いつないでいる元一流ボクサーの中年男が、難病ALSと診断される。最後の闘いとして、幼い頃に見捨てた娘に会い、過去の過ちに向き合おうとする。,インディーズ系ヒューマンドラマ
d@bbe 6,ある晩、就寝中に突然死亡した母親。心臓専門医の娘が死因を探ろうとする中、死の様子を目撃していたもう1人の娘が、母を殺したのは邪悪な悪霊だと訴え...。,超常現象ホラー
ワン・モア・タイム,売れないミュージシャンは何もかも上手くいかず、実家に身を寄せることに。だが、往年の名歌手だった父が復帰を目指し始め、彼女の日常はますます混乱してゆく。,アメリカ映画
アメリカ,野心を抱きインドの小さな村からアメリカへ旅立った青年。やがてその消息は途絶え、彼を探しに旅に出た弟を待ち受けていたのは、予想外の冒険だった。,高い評価を得た映画
ラブ・イズ・ア・ストーリー,男はバイオリニストとして、女は女優として成功するため、必死にあがいている。聖なる夜に始まった、ふたりの恋。彼らは何度クリスマスを共に迎えられるのか。,官能的なラブロマンス
アビー・センの時間旅行,失業を重ねること7回目、SFマニアのTVプロデューサーは1980年へタイムトラベル。もう一度過去からやり直せば、良い仕事にありつけると思ったのだが…。,SFヒューマンドラマ
幸福のガンパティ,寺院爆破を企むテロリストが、ヒンドゥー教の神のぬいぐるみに爆弾を仕掛ける。しかし、子供がそれを盗んで逃走。ぬいぐるみを追って男はムンバイ中を駆け巡る。,マラーティー語の映画
穴の中のホタル －鉱山で働く子供たち－,インドの北東部にある違法炭鉱で働く労働者や、その家族に焦点を当てたドキュメンタリー。11歳のスーラジは生きていくため、炭鉱で働いていたのだが...。,海外ドキュメンタリー
恋するパイロット,香港をベースとする航空会社を舞台に、3人の若手パイロットの恋愛模様を描く。三者三様の出会いや再会から機上のロマンスが展開していく。,海外ラブロマンス
昨日への道,結婚生活に亀裂の入ったヴィクトリアとイズの夫婦が、旅の途中で関係を修復しようとする。だが長い間隠していた秘密が明されることで、さらに複雑な状況に陥る。,海外/ヒューマンドラマ
天使になったサラ,善良な市民として暮らしてきた女性がクリスマスを前に事故死。天国へ行くはずが、予約リストに名前がない?! 天使として地上へ戻り、人助けをすることに。,アメリカ映画
ジンザナ 留置所ゲーム,回復中のアル中男性が、小さな町警察の留置場で目を覚ます。檻の中で異常なサディストとの心理ゲームを行うことになり...。,マインドゲームスリラー
私たちが飛べる日,仲良しの男子2人といつも一緒だった女子高生も今やアラフォー。その1人との結婚生活はマンネリ気味。同窓会をきっかけに、もう1人の彼のことを思い出し...。,海外ラブロマンス
フォーリング,夫が突然の事故に遭い、意識不明の重体に。そのまま長い昏睡状態に陥いるが、妻の前に新たな男性が現れ...。夫と築いてきた結婚生活、夫への愛の行方は?,ヒューマンドラマ
アリババと七人のこびと,庭に飾る置物を売っている義理の兄弟は、見本市に参加することに。ところが、2人はマフィアのボスが関わるトラブルに巻き込まれてしまい、大騒動を繰り広げる。,コミカルなコメディ
家族の難題,謎に包まれた人生を送る祖母に会うことで、隠された家族の真実を紐解こうと、一人の映画監督がカメラ片手に異国の地に向かう。家族の愛憎に迫るドキュメンタリー。,海外ドキュメンタリー
リトルG,両親を亡くし、ベイルートからLAの祖父の元にやってきた12才のアラム。だが、米国暮らしの厳しさから、アルメニア人ギャングと行動を共にするようになる。,アメリカ映画
湖の娘: アンデスの水を守る,アンデスの地中に眠る金を巡り、母なる湖は危機に瀕し、女性は住む土地を追われようとしていた。掘削業者から大地を守るため、彼女の孤独な戦いが幕を開ける。,中南米映画
メインで過ごした5日間,交通事故で失った最愛の妻。打ちひしがれた男は疎遠になっていた義母の住むメイン州へ。残された者たちがもがき、たぐり寄せる記憶、新事実、そして安らぎとは。,インディーズ系ヒューマンドラマ
ボンビニ・バンガローへ ようこそ,ギャングを怒らせた陽気な詐欺師はオランダへ逃亡。そこには、美女との運命の出会いが。大切なのは愛か、金儲けか。悪知恵を駆使しても、答えを出すのは難しい!,コミカルなコメディ
マイ・オウン・マン,妻が男児を妊娠。父親になる自信を持てずに不安を感じる主人公は、男らしさの探求を始めるが...!?,海外ドキュメンタリー
フレンチ・ダーティー,目的も職もないミレニアル世代の青年と友人。大人になりきれない2人だが、友人の彼女と関係を持ってしまったことをきっかけに、青年は変わらざるを得なくなる。,インディーズ系ヒューマンドラマ
